 1105, 6, Dorris, https://s3.amazonaws.com/uifaces/faces/twitter/leehambley/128.jpg, Fri Jun 29 2012 16:01:02 GMT-0700 (PDT), Hic unde placeat perferendis doloribus autem consequatur. Et dolor ipsam voluptas eius illum deserunt. Inventore aspernatur suscipit consequatur ea iure reprehenderit consectetur eligendi. Temporibus quae exercitationem nemo fugit ut ea corrupti enim ex. Voluptatem a ipsa sint fugiat amet voluptatem exercitationem tempore. Nesciunt quaerat a molestiae et incidunt., 4, 4, 3, 3, 1, 1, 4
 1106, 11, Rocio, https://s3.amazonaws.com/uifaces/faces/twitter/eugeneeweb/128.jpg, Thu Jun 21 2012 17:19:56 GMT-0700 (PDT), Mollitia nobis sunt. Dolores quis est id iste hic mollitia doloremque earum. Eum voluptatem voluptate illo dignissimos odio eum optio quis nulla., 2, 3, 5, 1, 1, 2, 4
 1107, 91, Maureen, https://s3.amazonaws.com/uifaces/faces/twitter/cbracco/128.jpg, Fri Apr 06 2012 01:28:10 GMT-0700 (PDT), Veniam doloribus porro. Sit soluta perferendis omnis autem sint sunt. Repudiandae molestiae ut. Quia accusamus quod optio aut aut., 3, 1, 2, 4, 4, 2, 4
 1108, 51, Arlene, https://s3.amazonaws.com/uifaces/faces/twitter/cdharrison/128.jpg, Wed Jun 08 2011 01:43:50 GMT-0700 (PDT), Voluptas molestiae commodi. Exercitationem reiciendis et enim voluptatum veniam. Facere est libero iure magnam dolores quam quae. Laudantium laborum reprehenderit in mollitia veritatis architecto nihil., 5, 4, 1, 1, 1, 1, 4
 1109, 23, Dawn, https://s3.amazonaws.com/uifaces/faces/twitter/alek_djuric/128.jpg, Tue Jun 07 2011 19:35:32 GMT-0700 (PDT), Qui necessitatibus et vel aliquid doloremque omnis in quae in. Laboriosam est culpa explicabo et in amet. Temporibus nihil quos. Et officia ut voluptatibus., 5, 4, 2, 5, 4, 2, 4
 1110, 50, Gracie, https://s3.amazonaws.com/uifaces/faces/twitter/ovall/128.jpg, Tue Mar 06 2012 05:09:57 GMT-0800 (PST), Quisquam iusto qui reiciendis maiores esse rerum itaque. Esse sed id ex inventore incidunt totam modi. Vero ea distinctio ullam ut esse ut animi velit. Aut vel saepe natus tenetur iure. Et sit sint est molestiae magni tempora nulla quos. Expedita eius omnis., 4, 3, 5, 3, 4, 1, 4
 1111, 49, Frank, https://s3.amazonaws.com/uifaces/faces/twitter/andrewofficer/128.jpg, Mon May 14 2018 01:51:26 GMT-0700 (PDT), Omnis ipsa repellat veniam aut facilis velit. Nemo minima ut voluptatem. Natus quis consequatur dolores numquam eum magnam ad et. Similique perferendis iusto minima. Iste itaque et voluptas aut quia. Voluptatem ab ipsa nulla modi aperiam., 5, 2, 4, 4, 3, 2, 5
 1112, 3, Florencio, https://s3.amazonaws.com/uifaces/faces/twitter/urrutimeoli/128.jpg, Wed Jun 13 2012 14:06:22 GMT-0700 (PDT), Ut consequatur repellat cum error dolores repellendus. Delectus laudantium aut voluptas sequi explicabo accusamus ut. Sed saepe omnis est nihil voluptates aliquid est ea recusandae. In temporibus placeat magnam cupiditate reiciendis. Adipisci a rerum rerum. Id consequuntur saepe non libero., 2, 4, 2, 4, 1, 2, 1
 1113, 18, Delia, https://s3.amazonaws.com/uifaces/faces/twitter/brandclay/128.jpg, Thu Feb 14 2013 14:53:29 GMT-0800 (PST), Velit qui cum praesentium in error. Dignissimos rerum possimus voluptas modi dicta. Eaque enim voluptatem dolores nulla rerum. Aut et ut iure maxime facilis. Expedita in inventore sint. Ipsam illo qui., 4, 3, 5, 3, 4, 5, 4
 1114, 19, Marilyne, https://s3.amazonaws.com/uifaces/faces/twitter/jydesign/128.jpg, Fri Jul 10 2015 02:59:05 GMT-0700 (PDT), Quidem sint enim blanditiis architecto voluptas debitis voluptatem est. Sed unde in. Aut eos hic laudantium temporibus dolor. Quaerat aut optio inventore vel ut aperiam ratione non voluptatem., 2, 1, 4, 3, 1, 1, 1
 1115, 54, Cora, https://s3.amazonaws.com/uifaces/faces/twitter/jimmuirhead/128.jpg, Sat Feb 03 2018 07:12:05 GMT-0800 (PST), Aspernatur quisquam qui. Ratione aut fugit ut quo qui et est quis. Tempora consequatur inventore qui doloribus., 1, 5, 1, 1, 4, 1, 2
 1116, 15, Robyn, https://s3.amazonaws.com/uifaces/faces/twitter/alevizio/128.jpg, Wed Dec 20 2017 11:24:58 GMT-0800 (PST), Atque rerum qui. Ut voluptates ut magni veniam ea praesentium aperiam occaecati ad. Ex modi assumenda molestiae dolores similique autem veniam., 5, 2, 4, 3, 2, 1, 5
 1117, 94, Thea, https://s3.amazonaws.com/uifaces/faces/twitter/wim1k/128.jpg, Fri Jan 28 2011 21:21:26 GMT-0800 (PST), Error atque magnam quasi. Vel tempore et unde hic sed consequatur. Dicta accusantium hic doloribus. Occaecati esse voluptatibus ad., 4, 5, 5, 2, 2, 4, 3
 1118, 62, Reggie, https://s3.amazonaws.com/uifaces/faces/twitter/cicerobr/128.jpg, Thu Dec 28 2017 23:59:17 GMT-0800 (PST), Et quae officia fugiat quia et. Veritatis omnis saepe sed fugiat molestias eveniet esse. Repellat et ullam nihil voluptas similique nam non consequuntur libero. Consectetur beatae voluptas. Occaecati eos accusantium et et asperiores praesentium voluptatem quos vel., 5, 4, 3, 2, 5, 1, 2
 1119, 15, Jalyn, https://s3.amazonaws.com/uifaces/faces/twitter/dvdwinden/128.jpg, Sun Mar 27 2011 03:52:11 GMT-0700 (PDT), Consectetur modi doloremque. Temporibus harum nisi incidunt. Aut quia et., 1, 4, 4, 5, 3, 3, 3
 1120, 83, Berry, https://s3.amazonaws.com/uifaces/faces/twitter/jasonmarkjones/128.jpg, Wed Jun 21 2017 19:31:16 GMT-0700 (PDT), Vitae ut deserunt dicta voluptas saepe. Voluptatum velit expedita est. Delectus laboriosam molestiae ab nostrum eaque suscipit., 2, 1, 1, 1, 2, 1, 1
 1121, 84, Gust, https://s3.amazonaws.com/uifaces/faces/twitter/aviddayentonbay/128.jpg, Sat May 06 2017 17:56:27 GMT-0700 (PDT), Voluptates atque iure ut quisquam. Laborum maiores cupiditate voluptatibus natus. Quo vel architecto voluptatem accusamus quam sit autem. Aliquid similique explicabo qui dolorum placeat ab tempore et sit. Magnam repellendus veniam ex consectetur sit. Necessitatibus quia asperiores sint ipsa et repellat., 2, 5, 3, 3, 5, 5, 3
 1122, 61, Gussie, https://s3.amazonaws.com/uifaces/faces/twitter/trubeatto/128.jpg, Tue Nov 06 2012 19:34:26 GMT-0800 (PST), Dolore consequatur dicta id officia. Esse deleniti voluptatum expedita veritatis aliquam deleniti nemo. Eveniet et aliquid non et. Magnam sapiente et doloribus ullam sunt assumenda sapiente voluptas molestiae., 4, 4, 1, 4, 4, 5, 1
 1123, 80, Natalia, https://s3.amazonaws.com/uifaces/faces/twitter/oskarlevinson/128.jpg, Tue May 25 2010 07:39:16 GMT-0700 (PDT), Sit doloremque reprehenderit dignissimos quibusdam ut ipsa ut. Minima eaque quam explicabo et placeat quia. Inventore harum atque. Magni nam unde consequatur reiciendis aliquid assumenda quidem aspernatur. Minima eos molestiae., 4, 1, 4, 4, 4, 2, 4
 1124, 87, Mckenna, https://s3.amazonaws.com/uifaces/faces/twitter/notbadart/128.jpg, Fri Dec 02 2011 00:08:03 GMT-0800 (PST), Sint enim voluptatibus praesentium necessitatibus. Pariatur similique neque in nulla quidem aliquid. Quasi unde dolor reiciendis animi fugit., 5, 1, 4, 5, 5, 3, 1
 1125, 60, Dahlia, https://s3.amazonaws.com/uifaces/faces/twitter/ismail_biltagi/128.jpg, Tue Sep 13 2016 12:37:38 GMT-0700 (PDT), Vel expedita et tenetur. Ut quam aliquid velit omnis ut ut. Ea ipsa alias molestiae excepturi omnis recusandae. Sequi impedit qui sed corrupti voluptatem. Neque molestiae laboriosam officiis nobis. Molestias rem omnis aut., 2, 3, 4, 5, 3, 4, 5
 1126, 79, Layne, https://s3.amazonaws.com/uifaces/faces/twitter/olaolusoga/128.jpg, Sun Jul 10 2016 08:38:49 GMT-0700 (PDT), Voluptatem accusamus nihil perferendis maiores. Temporibus aut unde tempore illum. Eum quos maiores et nesciunt adipisci., 4, 1, 1, 5, 3, 3, 2
 1127, 74, Mariela, https://s3.amazonaws.com/uifaces/faces/twitter/giancarlon/128.jpg, Mon Jan 09 2012 11:31:27 GMT-0800 (PST), Quae aut ut ut quibusdam ipsam. Aut provident itaque doloremque perspiciatis atque. Omnis ut optio., 5, 2, 3, 3, 1, 3, 5
 1128, 82, Carey, https://s3.amazonaws.com/uifaces/faces/twitter/airskylar/128.jpg, Tue Jun 24 2014 13:52:32 GMT-0700 (PDT), Et rem dignissimos ut quae et tempora hic consequatur quia. Quia doloremque quo perspiciatis. Pariatur omnis nam laboriosam velit quasi voluptatum. Repellendus quaerat ea qui animi nesciunt ullam., 3, 1, 5, 4, 1, 1, 5
 1129, 36, Hollie, https://s3.amazonaws.com/uifaces/faces/twitter/vinciarts/128.jpg, Fri Mar 11 2016 06:28:30 GMT-0800 (PST), Debitis iste est nesciunt iure sit molestiae. Eaque quia veritatis voluptas tenetur ut nihil cum vel unde. Dolores ut autem dolore quis aut illum et porro. Quia iste itaque numquam nulla ratione sint aut. Officia quod cumque praesentium. Consectetur dignissimos explicabo nemo eligendi expedita hic., 4, 2, 5, 1, 5, 4, 5
 1130, 15, Adrian, https://s3.amazonaws.com/uifaces/faces/twitter/9lessons/128.jpg, Sun May 13 2012 14:08:49 GMT-0700 (PDT), Minima voluptatem voluptatum recusandae nesciunt quas sit. Est dolorum et ea est eos. Odio cum sint id et. Enim qui facere sequi. Nihil hic sit. Architecto beatae odio ut enim voluptatum., 3, 2, 4, 2, 4, 3, 4
 1131, 85, Eli, https://s3.amazonaws.com/uifaces/faces/twitter/soffes/128.jpg, Sat Dec 04 2010 08:34:52 GMT-0800 (PST), Minus ipsa expedita perferendis et est. Praesentium molestiae aliquam deserunt voluptas quod minus totam possimus tenetur. Quod voluptatum nostrum veniam inventore doloremque qui ut. Officiis reprehenderit necessitatibus reprehenderit beatae voluptate expedita beatae voluptatem in. Architecto odio vero iure sint voluptatem aut at et sunt., 4, 3, 4, 1, 1, 5, 5
 1132, 85, Gregoria, https://s3.amazonaws.com/uifaces/faces/twitter/terryxlife/128.jpg, Fri Aug 03 2018 06:08:55 GMT-0700 (PDT), Non facere possimus quibusdam delectus laboriosam. Debitis et deleniti qui. Dolore aliquam excepturi iste omnis accusantium dolor nesciunt., 5, 4, 2, 2, 4, 1, 4
 1133, 70, Meta, https://s3.amazonaws.com/uifaces/faces/twitter/algunsanabria/128.jpg, Fri Feb 10 2012 19:24:48 GMT-0800 (PST), Voluptate maxime nostrum ut distinctio illum laborum aperiam laboriosam. Natus similique corporis. Repudiandae eum sed accusantium iste explicabo alias quo cumque. Hic officiis dolores est nihil mollitia et harum. Et debitis provident. Iusto aspernatur minus eveniet occaecati sit., 1, 5, 5, 4, 5, 3, 2
 1134, 52, Ally, https://s3.amazonaws.com/uifaces/faces/twitter/caseycavanagh/128.jpg, Wed Aug 07 2013 15:14:44 GMT-0700 (PDT), Ea et veniam cumque consectetur. Aut distinctio temporibus numquam possimus cum asperiores. Fugit aut accusamus molestiae. Et a est doloribus consequuntur. Mollitia magni quis repellat alias., 5, 2, 3, 5, 1, 4, 2
 1135, 2, Kaylah, https://s3.amazonaws.com/uifaces/faces/twitter/afusinatto/128.jpg, Sat May 08 2010 09:52:10 GMT-0700 (PDT), Vero vero aliquid blanditiis rerum. Impedit minus soluta natus quod aut impedit est quos. A consequatur cupiditate. Ut non tempora eveniet. Consequuntur dolorem molestiae. Facilis beatae deleniti rerum inventore sit repellendus deleniti., 1, 5, 4, 4, 5, 3, 1
 1136, 49, Antoinette, https://s3.amazonaws.com/uifaces/faces/twitter/nicolasfolliot/128.jpg, Thu May 19 2011 20:01:28 GMT-0700 (PDT), Vel voluptas aperiam tenetur dolor officia. Quia rem delectus consectetur minima voluptatem repellendus consequatur aliquam. Consectetur corporis quia aspernatur libero velit. Reiciendis voluptatem sit dolorem quasi. Id ipsam fugit officiis minus atque. Cum quo ad consequatur quas suscipit et explicabo culpa molestiae., 3, 3, 3, 4, 1, 4, 3
 1137, 2, Eveline, https://s3.amazonaws.com/uifaces/faces/twitter/fluidbrush/128.jpg, Sat Nov 25 2017 20:08:51 GMT-0800 (PST), Corporis et amet. Facilis sint maxime consequatur aut perferendis vero beatae aut. Qui et perferendis., 1, 5, 3, 1, 2, 2, 2
 1138, 18, Devan, https://s3.amazonaws.com/uifaces/faces/twitter/maiklam/128.jpg, Mon Sep 05 2016 03:52:20 GMT-0700 (PDT), Maxime porro quae molestias et distinctio. Tempora vero officiis. Voluptatum amet corrupti quia corporis sint atque iusto nisi. Fugit quisquam autem. Ea laudantium recusandae., 5, 1, 2, 3, 1, 5, 3
 1139, 83, Diana, https://s3.amazonaws.com/uifaces/faces/twitter/collegeman/128.jpg, Thu May 10 2018 18:16:19 GMT-0700 (PDT), Eligendi voluptate repellat dolorem suscipit quia accusamus magni et. Hic neque illum sint ut. Veniam aperiam voluptatum quasi. Omnis molestiae architecto sed aspernatur iure et iste. Dolores nulla dolores numquam veniam quas saepe., 2, 1, 2, 3, 3, 5, 4
 1140, 13, Melyssa, https://s3.amazonaws.com/uifaces/faces/twitter/wearesavas/128.jpg, Wed Oct 01 2014 12:04:22 GMT-0700 (PDT), Eum voluptates eum quae maxime aut. Error id corrupti. Et cum a sit provident. Facere et excepturi repellendus., 4, 5, 1, 4, 1, 3, 2
 1141, 47, Samir, https://s3.amazonaws.com/uifaces/faces/twitter/iamkeithmason/128.jpg, Tue Sep 30 2014 22:00:07 GMT-0700 (PDT), Minima fugit voluptatem eius. Dolorem aut tempora sit vel nemo quo. Cumque temporibus quod et eius ad. Ipsam est quia. Voluptatibus harum explicabo velit fuga., 3, 5, 3, 4, 2, 4, 5
 1142, 58, Kian, https://s3.amazonaws.com/uifaces/faces/twitter/operatino/128.jpg, Mon May 21 2012 11:03:50 GMT-0700 (PDT), Similique sit sint dolor voluptatem. Magni delectus eos qui. Qui ratione aperiam sequi doloribus quia. Molestiae sapiente optio possimus eos dolorem voluptas autem. Consequatur porro odit neque numquam laudantium cupiditate quaerat. Aut velit quo., 5, 5, 3, 1, 3, 1, 1
 1143, 6, Jonas, https://s3.amazonaws.com/uifaces/faces/twitter/traneblow/128.jpg, Thu Jul 28 2016 05:28:17 GMT-0700 (PDT), Voluptas blanditiis itaque quisquam. Quis ut delectus hic quis sunt dolores qui. Ipsum aliquid atque illum dolore nihil ipsa facilis perferendis accusantium., 3, 3, 2, 1, 1, 5, 5
 1144, 46, Clementina, https://s3.amazonaws.com/uifaces/faces/twitter/coreyhaggard/128.jpg, Sun Aug 16 2015 03:41:09 GMT-0700 (PDT), Perspiciatis et et repellendus sapiente ea commodi quas velit. Excepturi quidem laudantium et accusamus harum eos ipsam et odit. Ea libero est nulla dolores id. Rerum fuga laborum voluptas eligendi modi., 1, 3, 5, 5, 5, 1, 5
 1145, 30, Jimmie, https://s3.amazonaws.com/uifaces/faces/twitter/mgonto/128.jpg, Fri Jun 11 2010 01:12:44 GMT-0700 (PDT), Error error voluptas fugiat asperiores. Suscipit sunt ratione est maxime quos. Aliquam sed ut. Aperiam nulla eligendi nostrum., 5, 2, 5, 5, 5, 3, 5
 1146, 99, Emma, https://s3.amazonaws.com/uifaces/faces/twitter/robturlinckx/128.jpg, Sat Oct 28 2017 14:44:17 GMT-0700 (PDT), Molestiae aliquid nesciunt laborum minus veniam architecto quibusdam. Optio ab neque autem est ut ea dolorem. Quae aspernatur ut unde. Velit quaerat eius iste laudantium voluptatem mollitia et. Recusandae voluptates eius libero ab aperiam excepturi quia eos., 3, 3, 4, 4, 3, 4, 4
 1147, 47, Terry, https://s3.amazonaws.com/uifaces/faces/twitter/abdullindenis/128.jpg, Fri Feb 23 2018 07:18:00 GMT-0800 (PST), Non tempore illo eum qui delectus quia. Et vel animi. Aut sint aliquam dicta minima enim sequi aperiam officiis., 5, 5, 4, 4, 1, 4, 2
 1148, 30, Mallory, https://s3.amazonaws.com/uifaces/faces/twitter/rmlewisuk/128.jpg, Tue Nov 11 2014 01:09:36 GMT-0800 (PST), Voluptas iusto optio aut odit ut. Repellat molestiae eum cupiditate. Ipsam qui voluptate ex quia dignissimos minima., 1, 3, 1, 1, 2, 2, 3
 1149, 67, Raven, https://s3.amazonaws.com/uifaces/faces/twitter/spacewood_/128.jpg, Sat May 22 2010 09:44:16 GMT-0700 (PDT), Nesciunt beatae ullam illum excepturi expedita eum eos. Maxime ut quo facilis aut eligendi ut voluptatibus. Fugit voluptatibus voluptatibus omnis. Dolorem perferendis reiciendis inventore. Aut minima velit tenetur. Quis doloribus quisquam sequi., 1, 4, 1, 1, 4, 1, 5
 1150, 6, Sydnee, https://s3.amazonaws.com/uifaces/faces/twitter/orkuncaylar/128.jpg, Tue Jan 28 2014 08:59:24 GMT-0800 (PST), Ut eos impedit. Accusantium repellat exercitationem ut blanditiis praesentium nam inventore. Rem debitis nostrum esse quidem. Sed saepe saepe doloribus exercitationem asperiores possimus unde sit. Vero omnis dolore dolorem et velit dignissimos ut veritatis tempore. Explicabo aut aliquid praesentium sapiente voluptatem a., 4, 3, 5, 1, 2, 1, 1
 1151, 70, Guiseppe, https://s3.amazonaws.com/uifaces/faces/twitter/woodydotmx/128.jpg, Fri Mar 12 2010 14:51:41 GMT-0800 (PST), Qui dolorum delectus dicta itaque est et fuga. Voluptates sed aut ipsa dolore. Consequatur inventore aut eos enim. Facere nulla voluptatem in voluptatem voluptates dolorum excepturi. Et ad minima laudantium est., 1, 5, 2, 3, 2, 3, 1
 1152, 5, Benjamin, https://s3.amazonaws.com/uifaces/faces/twitter/estebanuribe/128.jpg, Fri Oct 16 2015 07:14:34 GMT-0700 (PDT), Est fuga et unde consequatur iusto quod minus. Et sint aut architecto. Quaerat odio sed. Nesciunt sint quas qui sapiente saepe esse et., 2, 3, 1, 4, 1, 5, 5
 1153, 75, Jason, https://s3.amazonaws.com/uifaces/faces/twitter/charliecwaite/128.jpg, Sat Sep 23 2017 13:59:31 GMT-0700 (PDT), Fuga incidunt placeat quia et in impedit voluptas molestias. Maxime omnis explicabo est totam sint et eos. In enim doloremque consectetur officia nisi voluptatem. Aspernatur quia animi. Dolorem facere animi ab facilis et consequatur a voluptatem non., 2, 5, 4, 2, 4, 3, 5
 1154, 58, Delbert, https://s3.amazonaws.com/uifaces/faces/twitter/smalonso/128.jpg, Mon Mar 11 2013 14:15:08 GMT-0700 (PDT), Eligendi assumenda soluta voluptatem et. Consequatur reiciendis ea laudantium voluptas. Commodi autem deserunt tenetur., 2, 3, 3, 3, 2, 5, 2
 1155, 11, Percy, https://s3.amazonaws.com/uifaces/faces/twitter/axel/128.jpg, Mon Oct 31 2016 16:13:40 GMT-0700 (PDT), Qui error autem non mollitia et veritatis et eius. Ratione et omnis rem. Sit eum facere est maxime nemo., 3, 3, 2, 1, 1, 4, 1
 1156, 55, Hollis, https://s3.amazonaws.com/uifaces/faces/twitter/m4rio/128.jpg, Mon Jul 12 2010 16:01:05 GMT-0700 (PDT), Facilis adipisci nihil velit voluptatem enim iste ducimus quidem ut. Et possimus voluptas qui a ut. Aliquid et quis facere voluptate et. Distinctio impedit aliquam sit aut consequuntur., 2, 3, 1, 3, 1, 2, 5
 1157, 34, Kaitlin, https://s3.amazonaws.com/uifaces/faces/twitter/donjain/128.jpg, Thu Apr 04 2013 01:51:51 GMT-0700 (PDT), Quaerat voluptates voluptatibus. Aut mollitia suscipit eum. Sint fuga fuga. Vitae libero facere repellendus in. Autem et quasi sit id minima rerum tempore eligendi fuga. Aut animi qui quis., 1, 5, 2, 3, 3, 3, 2
 1158, 33, Lyla, https://s3.amazonaws.com/uifaces/faces/twitter/dicesales/128.jpg, Sun Oct 14 2012 13:16:19 GMT-0700 (PDT), Veniam beatae ut velit. Odit dolores non et omnis enim consectetur reiciendis. Voluptas mollitia voluptas. Quam voluptate recusandae sint magni aut error quisquam nihil. Et animi velit provident reprehenderit. Vel voluptas reiciendis maxime sunt blanditiis dignissimos., 1, 3, 3, 2, 1, 5, 5
 1159, 55, Freida, https://s3.amazonaws.com/uifaces/faces/twitter/ahmadajmi/128.jpg, Fri Jun 19 2015 09:48:55 GMT-0700 (PDT), Harum et eum quia sequi quis aut reiciendis quibusdam maxime. Dicta iste quia consequatur autem harum eveniet similique rem officiis. Omnis molestiae deserunt aut perspiciatis nobis. Quisquam aliquam expedita qui maiores nesciunt quis. Eos impedit aperiam., 2, 3, 1, 3, 4, 2, 1
 1160, 78, Triston, https://s3.amazonaws.com/uifaces/faces/twitter/wiljanslofstra/128.jpg, Sun Feb 15 2015 20:27:47 GMT-0800 (PST), Harum ullam sed facere vitae eaque voluptatem cum et quos. Quod dolorem quod veniam fugit eligendi dolorum aliquid. Vel necessitatibus dolores tempora laborum enim repudiandae dolorem enim. Minus sunt eius quam architecto et sed., 2, 4, 4, 3, 2, 4, 1
 1161, 47, Connie, https://s3.amazonaws.com/uifaces/faces/twitter/BroumiYoussef/128.jpg, Sun Jan 21 2018 04:25:17 GMT-0800 (PST), Quo consequatur dolor veniam magni suscipit reiciendis fugiat. Ab nulla et alias pariatur ratione reiciendis ea voluptatem. Quia error ullam iure consequuntur qui laudantium. Dolore eos deserunt ullam doloremque ab. Sunt velit alias exercitationem., 2, 5, 4, 3, 5, 2, 4
 1162, 92, Presley, https://s3.amazonaws.com/uifaces/faces/twitter/jagan123/128.jpg, Mon Dec 23 2013 19:07:29 GMT-0800 (PST), Quis libero non accusantium aspernatur id praesentium et. Est vero ipsam laudantium et veritatis suscipit repudiandae qui. Laboriosam blanditiis ut voluptas quos., 4, 3, 5, 3, 5, 2, 5
 1163, 29, Rogers, https://s3.amazonaws.com/uifaces/faces/twitter/dnirmal/128.jpg, Tue Oct 05 2010 16:09:01 GMT-0700 (PDT), Suscipit eos nisi alias ea. Omnis voluptatem amet dolor consectetur ut. Iusto ut nam incidunt sed sed. Ratione consequatur dolor consequatur., 5, 3, 3, 1, 5, 5, 2
 1164, 35, Nedra, https://s3.amazonaws.com/uifaces/faces/twitter/enjoythetau/128.jpg, Fri Oct 15 2010 18:52:07 GMT-0700 (PDT), Laudantium perspiciatis quis molestias sapiente laudantium hic recusandae quo perferendis. Soluta maxime consectetur sequi labore excepturi ipsa. Aperiam consequatur architecto porro. Laudantium recusandae et modi nobis dicta mollitia quis fuga beatae., 1, 2, 3, 4, 3, 2, 2
 1165, 73, Blanche, https://s3.amazonaws.com/uifaces/faces/twitter/angelceballos/128.jpg, Fri May 07 2010 20:15:08 GMT-0700 (PDT), Omnis voluptatem dolor et facere. Odio commodi dolorem. Tempore sapiente et magni. Rerum provident harum qui ipsam maxime exercitationem voluptatem non., 4, 4, 5, 5, 3, 4, 3
 1166, 29, Bo, https://s3.amazonaws.com/uifaces/faces/twitter/twittypork/128.jpg, Sat Sep 10 2011 21:50:37 GMT-0700 (PDT), Saepe et sed nihil facilis nihil non. Adipisci magnam ut occaecati beatae qui officia et. Exercitationem eius beatae. Libero explicabo sed., 1, 4, 3, 2, 2, 4, 5
 1167, 49, Delaney, https://s3.amazonaws.com/uifaces/faces/twitter/pechkinator/128.jpg, Thu Apr 12 2018 03:43:49 GMT-0700 (PDT), Excepturi quos aut veritatis. Laborum dolor eos. Adipisci nobis corporis nesciunt omnis eum debitis repellendus. Quis nam voluptatem ut similique natus aut exercitationem laudantium eaque. Incidunt placeat exercitationem et autem consequatur., 2, 3, 4, 5, 5, 2, 1
 1168, 100, Flossie, https://s3.amazonaws.com/uifaces/faces/twitter/vladarbatov/128.jpg, Thu Feb 18 2016 17:57:54 GMT-0800 (PST), Quibusdam temporibus iure perferendis similique distinctio. Veritatis ab doloribus numquam esse natus perspiciatis repellat. Dolorum velit ipsam voluptatem et. Et ipsum repellat ea aut assumenda autem et qui in. Laudantium quod porro occaecati odit quos. Enim ut in ducimus ut., 1, 3, 5, 2, 5, 2, 1
 1169, 50, Keyshawn, https://s3.amazonaws.com/uifaces/faces/twitter/vladarbatov/128.jpg, Mon Oct 18 2010 01:22:11 GMT-0700 (PDT), Rem tempore vel aut odit aliquid laudantium. Fugit dicta occaecati itaque magnam minus placeat nisi quaerat quaerat. Et error illum. Et ea eos quis est architecto. Soluta totam voluptatem blanditiis., 5, 5, 2, 2, 1, 1, 2
 1170, 93, Ramon, https://s3.amazonaws.com/uifaces/faces/twitter/ajaxy_ru/128.jpg, Sat Jan 17 2015 03:32:27 GMT-0800 (PST), Ut et molestiae repellendus optio. Voluptate cum hic cum ab hic inventore. Sed est nisi et. Totam iste pariatur. Voluptatum ut sint ea quam sint consectetur velit., 2, 1, 4, 5, 3, 5, 2
 1171, 50, Sister, https://s3.amazonaws.com/uifaces/faces/twitter/myastro/128.jpg, Fri Jul 16 2010 20:24:17 GMT-0700 (PDT), Laboriosam error aut cum eos aliquid pariatur quibusdam esse quo. Quo voluptate dolores quas aliquid. Totam libero ex et neque quia nobis fuga recusandae. Ratione fugit nobis. Nisi atque nihil libero fuga quia similique id aut. Iure aut maxime dolor veniam., 5, 2, 5, 3, 2, 4, 1
 1172, 38, Estelle, https://s3.amazonaws.com/uifaces/faces/twitter/the_purplebunny/128.jpg, Thu Mar 31 2011 07:55:11 GMT-0700 (PDT), Perferendis perspiciatis culpa aspernatur fugit aut qui numquam. Et reprehenderit sint. Velit facilis expedita doloribus animi mollitia atque. Cum itaque in consequatur ut distinctio et ut quo. Ipsam autem dolores veniam aut harum. Ut modi asperiores consequatur rerum in et facere et., 4, 2, 5, 3, 1, 2, 2
 1173, 38, Myrtis, https://s3.amazonaws.com/uifaces/faces/twitter/demersdesigns/128.jpg, Thu Nov 13 2014 06:32:00 GMT-0800 (PST), Veniam suscipit perspiciatis omnis recusandae aut voluptatibus rerum officia. Doloribus quis et iste quasi. Est dolorum modi neque dolor modi ut. Quaerat voluptas qui et in placeat est. Maiores magnam tempora laboriosam. Ut dolores minima et., 5, 5, 1, 4, 1, 4, 5
 1174, 51, Maudie, https://s3.amazonaws.com/uifaces/faces/twitter/ryhanhassan/128.jpg, Wed Oct 03 2012 01:00:53 GMT-0700 (PDT), Pariatur voluptatem sed possimus aperiam eos voluptatem. Quis et qui et rerum. Molestiae voluptas dignissimos. Quia soluta blanditiis ipsa repellat modi., 3, 4, 1, 1, 2, 5, 3
 1175, 70, Rosamond, https://s3.amazonaws.com/uifaces/faces/twitter/roybarberuk/128.jpg, Sat Oct 29 2011 02:16:15 GMT-0700 (PDT), Porro mollitia numquam fugiat et fugit nostrum. Voluptatem temporibus molestiae doloribus eveniet qui quam dolores atque. Optio sint est ipsam et vitae voluptatem excepturi dolores voluptas. Placeat at vel est quasi aut vitae doloremque doloribus voluptatum. Earum voluptates dolore voluptatem culpa omnis harum ut., 3, 1, 4, 4, 4, 5, 4
 1176, 43, Deonte, https://s3.amazonaws.com/uifaces/faces/twitter/marlinjayakody/128.jpg, Sat Apr 20 2013 07:29:00 GMT-0700 (PDT), Aut rem non molestias ut maiores molestiae porro. Velit excepturi tempora ipsa labore minus quis. Dolores totam dolor repellat modi sit. Voluptatem ut sit dolorum autem., 1, 5, 5, 3, 3, 3, 1
 1177, 83, Alexane, https://s3.amazonaws.com/uifaces/faces/twitter/oskamaya/128.jpg, Mon Sep 08 2014 02:40:02 GMT-0700 (PDT), Doloremque laborum molestias ipsam. Dolorem consequatur sint quasi. Dolores iusto aliquid sed sit minima qui vel voluptas., 3, 4, 4, 4, 2, 1, 2
 1178, 85, Randall, https://s3.amazonaws.com/uifaces/faces/twitter/mizhgan/128.jpg, Sun Apr 22 2018 06:23:52 GMT-0700 (PDT), Sapiente est nam vel soluta doloremque. Autem fuga qui velit qui sed est. Eaque est et quam veniam ut ab iste. Nobis cumque enim voluptatem voluptas est qui quas consequatur., 4, 1, 4, 5, 4, 4, 5
