 736, 77, Hector, https://s3.amazonaws.com/uifaces/faces/twitter/irae/128.jpg, Sat Oct 19 2013 19:27:02 GMT-0700 (PDT), Sequi id sequi ut corrupti. Reiciendis non quibusdam mollitia nemo dolor odit explicabo. Perferendis totam aliquid enim qui ab accusantium doloremque molestiae tempora. In minus non consectetur magnam eaque. Voluptates et impedit cumque laboriosam qui voluptatem., 4, 1, 4, 2, 2, 1, 4
 737, 80, Nickolas, https://s3.amazonaws.com/uifaces/faces/twitter/mangosango/128.jpg, Wed May 04 2011 11:41:57 GMT-0700 (PDT), Odit necessitatibus adipisci ipsum expedita hic eos. Libero tempore animi qui et. Similique quia itaque quae sequi atque eaque enim qui dolores. Dolore velit repudiandae veritatis autem. Placeat sapiente eos., 1, 1, 1, 4, 1, 2, 4
 738, 96, Ursula, https://s3.amazonaws.com/uifaces/faces/twitter/darylws/128.jpg, Wed Mar 10 2010 17:54:15 GMT-0800 (PST), Et et sed. Hic ea explicabo est debitis est fugit odio. Repellat expedita veniam et repudiandae assumenda sunt ad molestiae velit. Non et nesciunt autem mollitia aut voluptatum sit et voluptatem., 5, 3, 2, 3, 2, 1, 2
 739, 54, Chaya, https://s3.amazonaws.com/uifaces/faces/twitter/andytlaw/128.jpg, Thu Apr 05 2018 22:53:38 GMT-0700 (PDT), Temporibus nemo praesentium autem deserunt quaerat. Doloribus molestias qui et quas et quia. Debitis non veritatis voluptatem magnam sed non. Mollitia nostrum error et aspernatur error quo a praesentium., 5, 2, 3, 2, 2, 1, 4
 740, 25, Lelah, https://s3.amazonaws.com/uifaces/faces/twitter/ionuss/128.jpg, Mon Jan 19 2015 18:48:19 GMT-0800 (PST), Est maiores quos omnis. Praesentium vitae vel mollitia qui aut autem maiores. Est quo sit consectetur est. Ex ut consequatur quo ea. Aliquid quasi aut omnis neque quas sapiente quibusdam eveniet., 3, 4, 4, 2, 2, 4, 1
 741, 72, Fatima, https://s3.amazonaws.com/uifaces/faces/twitter/ooomz/128.jpg, Tue Oct 14 2014 12:44:31 GMT-0700 (PDT), Autem illum aut qui. Voluptatibus cum excepturi unde et doloremque autem incidunt tenetur sequi. Similique non nostrum blanditiis est consequatur suscipit fugiat quia vero. Quia dicta accusantium nihil iure quam enim recusandae quis suscipit. Consequatur esse nesciunt. Atque quod facere vero veritatis deleniti nostrum enim., 2, 5, 1, 2, 2, 4, 2
 742, 16, Veda, https://s3.amazonaws.com/uifaces/faces/twitter/saulihirvi/128.jpg, Tue Nov 27 2012 09:53:45 GMT-0800 (PST), Fuga distinctio consequatur et sit dolore unde maxime sit. Ad at quia eum totam laboriosam velit. Dicta quidem modi est et minima ut ut. Placeat quia consequatur totam molestiae., 4, 4, 2, 4, 3, 1, 5
 743, 8, Noemi, https://s3.amazonaws.com/uifaces/faces/twitter/atanism/128.jpg, Sun Mar 22 2015 07:11:37 GMT-0700 (PDT), Laudantium sit repudiandae fugit blanditiis corrupti. Consequuntur nisi nihil eius non. Illum ullam et quidem quis voluptatem. Voluptatibus quia qui nihil possimus asperiores., 3, 4, 5, 2, 2, 5, 2
 744, 35, Makenzie, https://s3.amazonaws.com/uifaces/faces/twitter/tbakdesigns/128.jpg, Tue Nov 27 2012 16:21:53 GMT-0800 (PST), Harum in voluptatem atque officia sit sit nulla et. Et et id alias maxime. Dolorem quidem accusantium ut numquam harum suscipit aliquam voluptates. Nesciunt qui qui voluptas quo voluptatibus corrupti sint eos voluptatibus. Laudantium et qui vitae non deleniti., 4, 4, 1, 1, 2, 2, 1
 745, 89, Al, https://s3.amazonaws.com/uifaces/faces/twitter/ashernatali/128.jpg, Sat Jul 05 2014 21:02:48 GMT-0700 (PDT), Rerum in eos ab voluptas. Assumenda totam omnis ab. Corporis veniam distinctio voluptas. Quasi et iure reiciendis eos nesciunt et aspernatur illo sint. Vel aut accusamus assumenda molestias similique aut sunt dolorem., 1, 3, 1, 3, 1, 1, 3
 746, 39, Angus, https://s3.amazonaws.com/uifaces/faces/twitter/anoff/128.jpg, Wed May 15 2013 14:15:40 GMT-0700 (PDT), Quia rerum minus soluta commodi. Et voluptatem ipsum possimus corrupti cupiditate numquam quae. Eius aspernatur cupiditate atque quae sit voluptatem perferendis. Sed eligendi amet ut quam eos velit fugiat officia dicta. Commodi pariatur aliquam quia maxime eaque enim iste qui., 2, 3, 1, 5, 5, 2, 5
 747, 85, Gwen, https://s3.amazonaws.com/uifaces/faces/twitter/SULiik/128.jpg, Fri Sep 23 2016 12:17:57 GMT-0700 (PDT), Eum quasi voluptatem praesentium earum consequatur architecto quia temporibus ad. Ut animi omnis praesentium eaque. Quia voluptas vitae odio et dolorem placeat ut. Vel harum recusandae. Vel debitis corrupti omnis maiores fugit cumque. Doloremque autem nemo omnis et ex dolor., 5, 1, 5, 4, 3, 4, 1
 748, 100, Diamond, https://s3.amazonaws.com/uifaces/faces/twitter/knilob/128.jpg, Sat Aug 01 2015 06:02:17 GMT-0700 (PDT), Et quidem blanditiis ipsa. Nobis id quo voluptatem alias ut debitis earum. Dolorum nisi amet velit. Alias sint fugit esse vitae. Mollitia sint eligendi vel eos temporibus tempore. Sit et nesciunt ab aperiam est dolore consequatur occaecati., 1, 3, 2, 5, 1, 1, 1
 749, 23, Reymundo, https://s3.amazonaws.com/uifaces/faces/twitter/miguelkooreman/128.jpg, Thu Feb 22 2018 15:39:26 GMT-0800 (PST), A eos quo. In sit placeat cum laborum. Porro est expedita., 3, 1, 1, 1, 2, 5, 5
 750, 50, Naomi, https://s3.amazonaws.com/uifaces/faces/twitter/mbilderbach/128.jpg, Thu Oct 10 2013 22:42:57 GMT-0700 (PDT), Odit ut blanditiis sed. Est est qui sunt dignissimos. Voluptates non facilis cupiditate eligendi accusamus quia reprehenderit. Molestiae dolore eligendi magnam reiciendis repellendus. Deleniti dolor consequuntur est sint. Accusamus repudiandae natus beatae corporis rerum tempora ipsa., 3, 5, 1, 1, 5, 1, 5
 751, 20, Vidal, https://s3.amazonaws.com/uifaces/faces/twitter/kojourin/128.jpg, Thu Jul 05 2018 09:53:38 GMT-0700 (PDT), Vel aliquid aut consequatur occaecati et similique dolorum laboriosam. Reprehenderit quis est numquam aut aliquid. Nostrum iure id omnis inventore delectus at deserunt rem enim. Reiciendis illum consequatur asperiores totam possimus reiciendis sit. Nostrum ducimus dolore., 5, 5, 4, 1, 1, 1, 2
 752, 14, Breanne, https://s3.amazonaws.com/uifaces/faces/twitter/martip07/128.jpg, Fri Apr 29 2016 11:37:28 GMT-0700 (PDT), Dolorem ex unde incidunt laboriosam in. Sunt magnam enim. Tempora et illum harum. Sunt nesciunt non quibusdam ut velit nihil. Temporibus ex nam aperiam quo quam ipsum qui iusto ullam. Ab aspernatur architecto est ratione et., 2, 3, 1, 2, 2, 2, 3
 753, 89, Margarette, https://s3.amazonaws.com/uifaces/faces/twitter/oscarowusu/128.jpg, Sun Mar 24 2013 11:07:18 GMT-0700 (PDT), Provident neque quaerat. Et est omnis. Qui itaque aliquam alias. Inventore ipsum consequuntur numquam culpa omnis maiores., 5, 2, 3, 1, 4, 1, 1
 754, 18, Lavonne, https://s3.amazonaws.com/uifaces/faces/twitter/katiemdaly/128.jpg, Thu Jul 08 2010 16:04:29 GMT-0700 (PDT), Ullam occaecati eligendi. Et ut aliquid quia dolorem nemo fugiat. Distinctio laboriosam accusantium natus quisquam nesciunt quod. Exercitationem est adipisci eaque neque. Iste architecto consectetur ad doloremque sunt veritatis. Id facilis nam facilis sint., 3, 4, 1, 4, 3, 3, 3
 755, 83, Tommie, https://s3.amazonaws.com/uifaces/faces/twitter/wim1k/128.jpg, Tue Jun 23 2015 09:31:49 GMT-0700 (PDT), Qui amet sunt. Porro sit cum qui explicabo. Suscipit aliquam sit sed sit corrupti ex maiores nihil quibusdam., 3, 4, 5, 4, 4, 3, 3
 756, 27, Alysson, https://s3.amazonaws.com/uifaces/faces/twitter/jimmuirhead/128.jpg, Thu Sep 10 2015 06:28:02 GMT-0700 (PDT), Corporis ut dolor quibusdam possimus est. Dolores neque sed iusto ullam vitae sequi saepe qui. Laborum cum laborum. Non aperiam veritatis amet molestiae est praesentium., 1, 2, 2, 3, 4, 4, 2
 757, 63, Ismael, https://s3.amazonaws.com/uifaces/faces/twitter/michigangraham/128.jpg, Tue Dec 14 2010 00:35:53 GMT-0800 (PST), Ullam corrupti error eos dicta ea eos error qui. Magnam sapiente tempore voluptatem. Aut est et cupiditate nemo veritatis aliquid. Consequatur omnis sint voluptatem sint nemo sunt nemo non occaecati. Ipsum iure et recusandae nihil consequatur maiores est impedit., 4, 1, 1, 5, 4, 2, 5
 758, 90, Pascale, https://s3.amazonaws.com/uifaces/faces/twitter/kucingbelang4/128.jpg, Fri Oct 07 2016 16:52:45 GMT-0700 (PDT), Dolor unde eum et deleniti inventore omnis. Quasi ducimus aliquam repudiandae earum. Iure dolore facere dolorum quis. Ea placeat natus doloribus. Repudiandae magnam et est ad deserunt sed consequatur. Hic unde tenetur consequuntur animi., 5, 4, 5, 2, 5, 3, 5
 759, 77, Loma, https://s3.amazonaws.com/uifaces/faces/twitter/robinlayfield/128.jpg, Fri Apr 29 2016 22:16:26 GMT-0700 (PDT), Minus est libero aut. Incidunt quasi sapiente aut. Sequi cumque id fugiat. Aut id et., 1, 1, 5, 2, 3, 4, 2
 760, 71, Eleanore, https://s3.amazonaws.com/uifaces/faces/twitter/flexrs/128.jpg, Sun Mar 25 2018 20:38:28 GMT-0700 (PDT), Eos nam fugiat quia dolorem ea eum est. Id similique quia aliquid officia quisquam. Quod minus eveniet quia error magnam itaque. Sapiente reiciendis nulla autem occaecati molestiae harum consequuntur. Sit atque beatae molestias. At voluptas sed quisquam vel aut dolorum sit et., 5, 1, 2, 4, 2, 3, 4
 761, 74, Dino, https://s3.amazonaws.com/uifaces/faces/twitter/doronmalki/128.jpg, Fri May 12 2017 03:20:32 GMT-0700 (PDT), Et et tempore dolor ut quam autem error dolorum harum. Nam eius non. Animi distinctio vero quia excepturi adipisci sit esse voluptatibus. Saepe repellat labore numquam cum dolorum est aliquid ut., 1, 3, 3, 5, 5, 5, 5
 762, 67, Wade, https://s3.amazonaws.com/uifaces/faces/twitter/bartjo/128.jpg, Wed Jul 06 2011 21:45:15 GMT-0700 (PDT), Nesciunt voluptates libero rerum reiciendis non sed et. Accusamus tenetur necessitatibus consequuntur culpa qui et non et. Est voluptas debitis praesentium nihil delectus reiciendis ratione totam explicabo., 4, 4, 3, 3, 2, 3, 5
 763, 1, Bianka, https://s3.amazonaws.com/uifaces/faces/twitter/andrewarrow/128.jpg, Fri Sep 30 2011 20:27:21 GMT-0700 (PDT), Qui quaerat sit ad dicta rerum eos quasi nostrum rerum. Harum velit est quas. Soluta sed numquam nam maiores laudantium ab rem ab. Sit enim cupiditate est. Dolorem voluptas est asperiores ex. Animi eos hic dolore ut sed quod porro quam officia., 4, 5, 1, 2, 3, 3, 1
 764, 41, Kevin, https://s3.amazonaws.com/uifaces/faces/twitter/guillemboti/128.jpg, Wed May 23 2012 21:55:36 GMT-0700 (PDT), Vel illum adipisci. Assumenda cum qui illo eius consequatur. Ut dignissimos optio. Quia aut dignissimos. Quis et nisi facere ea tempore., 5, 1, 4, 3, 5, 2, 1
 765, 96, Christine, https://s3.amazonaws.com/uifaces/faces/twitter/darcystonge/128.jpg, Tue Aug 08 2017 22:21:43 GMT-0700 (PDT), Aut voluptatum consectetur qui atque alias ut. Voluptas illo veniam architecto aliquid nostrum doloribus quidem ipsam facere. Quam quod ea exercitationem itaque cupiditate sed. At veritatis adipisci eius soluta odit tempore dolorum., 5, 1, 5, 4, 2, 5, 3
 766, 10, Zelma, https://s3.amazonaws.com/uifaces/faces/twitter/ooomz/128.jpg, Fri Dec 29 2017 18:11:41 GMT-0800 (PST), Doloribus vitae suscipit sed. Quia error accusantium recusandae quos perspiciatis recusandae omnis aut rem. Iure modi nihil illum accusamus inventore dolore. Modi saepe reprehenderit quo excepturi explicabo vel deleniti repudiandae dolorem. Dolores asperiores qui at placeat dolorum dolores quasi et beatae., 5, 4, 4, 5, 3, 1, 3
 767, 50, Jalon, https://s3.amazonaws.com/uifaces/faces/twitter/vitorleal/128.jpg, Wed Aug 24 2011 01:47:25 GMT-0700 (PDT), Id qui quos at repudiandae. Voluptas culpa facilis excepturi voluptatem aut. Vel aut quisquam velit cumque. Aut mollitia dolorum doloremque quia molestiae nam nostrum quia. Saepe ipsa autem., 4, 1, 1, 1, 2, 1, 1
 768, 90, Althea, https://s3.amazonaws.com/uifaces/faces/twitter/ademilter/128.jpg, Tue Oct 08 2013 06:24:25 GMT-0700 (PDT), Saepe accusantium veniam itaque dignissimos qui distinctio aliquam. Atque enim officia ut voluptates deserunt et sint architecto. Non ad qui fugit suscipit veritatis., 5, 3, 5, 3, 5, 1, 1
 769, 64, Chance, https://s3.amazonaws.com/uifaces/faces/twitter/ddggccaa/128.jpg, Wed Mar 11 2015 10:41:47 GMT-0700 (PDT), Cum quia vitae iste autem harum rerum possimus iure. Nemo consequuntur accusamus iste consequatur vel minus. Vel consequatur commodi rem quia. Eum voluptate tenetur. Sint quasi quae et. Id aut et quibusdam at ut commodi., 5, 5, 2, 2, 4, 4, 2
 770, 41, Mohammed, https://s3.amazonaws.com/uifaces/faces/twitter/miguelmendes/128.jpg, Sun Feb 01 2015 09:10:35 GMT-0800 (PST), Esse enim ut cum possimus molestias harum officiis sed ut. Corrupti minus odit ut eaque impedit est qui illum. Nemo ut maxime ducimus voluptatibus amet inventore qui. Culpa alias aut qui., 3, 3, 4, 3, 5, 4, 2
 771, 14, Emmalee, https://s3.amazonaws.com/uifaces/faces/twitter/timpetricola/128.jpg, Tue Jun 02 2015 09:02:33 GMT-0700 (PDT), Ipsam optio aut voluptates modi. Dicta porro repudiandae quasi itaque facere alias maxime tempora nisi. Voluptas optio sit suscipit ipsum et ut praesentium amet consequatur., 4, 1, 1, 3, 5, 5, 5
 772, 32, Deshawn, https://s3.amazonaws.com/uifaces/faces/twitter/fran_mchamy/128.jpg, Fri Aug 12 2016 06:45:38 GMT-0700 (PDT), Fugiat ut omnis mollitia porro consequatur velit. Est beatae enim ut. Aliquid aut dolores architecto sunt ut rem aut doloribus., 4, 5, 1, 5, 1, 4, 1
 773, 37, Harvey, https://s3.amazonaws.com/uifaces/faces/twitter/sur4dye/128.jpg, Wed Mar 08 2017 05:03:04 GMT-0800 (PST), Est facere enim corporis doloremque ea doloremque quia. Quas ea voluptatem illum eum mollitia. Accusamus molestiae libero ad delectus accusamus consectetur maiores ea. Minus praesentium sit repudiandae alias similique nesciunt. Rem et quas rem qui nemo et reprehenderit., 4, 2, 4, 3, 1, 3, 2
 774, 4, Ryley, https://s3.amazonaws.com/uifaces/faces/twitter/gearpixels/128.jpg, Fri Jun 06 2014 11:29:05 GMT-0700 (PDT), Eius voluptatem assumenda ut officia. Neque tenetur voluptatem. Omnis sit ducimus natus veritatis praesentium et aut error a. Quo officia molestiae a ad odit enim optio sed. Doloribus autem suscipit. Occaecati aut exercitationem illo laborum suscipit recusandae., 1, 3, 4, 4, 5, 1, 1
 775, 43, Ashton, https://s3.amazonaws.com/uifaces/faces/twitter/imammuht/128.jpg, Thu Jun 26 2014 14:48:27 GMT-0700 (PDT), Est sed nihil saepe ipsum aspernatur rem. Amet nihil pariatur. Voluptas eaque provident voluptates ipsam eveniet modi amet sint corporis., 2, 5, 5, 2, 4, 2, 4
 776, 51, Jaime, https://s3.amazonaws.com/uifaces/faces/twitter/travis_arnold/128.jpg, Fri Apr 08 2016 08:34:04 GMT-0700 (PDT), Ducimus aut et veniam consequatur. Quis sit ab temporibus ea quia id rerum laboriosam aliquid. Praesentium minus eveniet voluptas ea. Odio eum perspiciatis deleniti veritatis ut necessitatibus deleniti., 2, 5, 4, 5, 1, 3, 5
 777, 52, Doyle, https://s3.amazonaws.com/uifaces/faces/twitter/guischmitt/128.jpg, Mon Jun 06 2011 17:34:05 GMT-0700 (PDT), Et est eum dolores. Hic ea eum numquam quis ipsa animi et sint magnam. Est et et voluptas. Ipsum non ab et nihil reiciendis doloremque eveniet qui eos. Aperiam magnam inventore rerum quam in quas minus velit voluptas., 5, 5, 2, 4, 4, 4, 3
 778, 36, Brandt, https://s3.amazonaws.com/uifaces/faces/twitter/pierrestoffe/128.jpg, Fri Aug 18 2017 08:21:31 GMT-0700 (PDT), Illum qui esse sed iusto. Odit aut recusandae deleniti quos molestias numquam quo. Soluta quo provident incidunt consequatur dolor unde vitae ullam quo. Laboriosam quaerat cumque quaerat. Veritatis fugit temporibus. Eum explicabo qui ipsum tempora enim accusantium eum quis., 4, 2, 5, 3, 2, 5, 3
 779, 80, Joan, https://s3.amazonaws.com/uifaces/faces/twitter/charlesrpratt/128.jpg, Sun Apr 24 2016 06:58:42 GMT-0700 (PDT), Dolorem et dolorem et corporis et deleniti in voluptas error. Maiores facilis nihil quas cupiditate sunt est. Dolores nisi et tempora accusamus blanditiis necessitatibus eaque. Fuga odio quia omnis praesentium omnis aut. Dolor voluptas animi., 2, 1, 3, 3, 3, 2, 5
 780, 37, Jonas, https://s3.amazonaws.com/uifaces/faces/twitter/baumann_alex/128.jpg, Wed Oct 15 2014 07:29:27 GMT-0700 (PDT), Omnis illum nisi qui. Quia libero inventore quo est nam nihil eum. Tempora explicabo reprehenderit exercitationem est animi modi impedit., 3, 5, 2, 3, 5, 1, 1
 781, 16, Cedrick, https://s3.amazonaws.com/uifaces/faces/twitter/isaacfifth/128.jpg, Fri Sep 24 2010 12:26:48 GMT-0700 (PDT), Praesentium maxime rerum culpa illo deserunt. Cum eos consequatur eaque cum culpa accusamus assumenda. Nam nisi voluptatem., 2, 4, 3, 2, 5, 2, 5
 782, 37, Duane, https://s3.amazonaws.com/uifaces/faces/twitter/davidbaldie/128.jpg, Mon Jan 16 2012 23:45:17 GMT-0800 (PST), Perferendis sint accusantium ea et rerum doloremque est modi qui. Deserunt reprehenderit accusamus. At tempore sit. Rerum quo officia. Repudiandae voluptatem cum inventore et. Dignissimos ducimus repellat assumenda et corporis nulla., 2, 4, 3, 1, 4, 1, 2
 783, 74, Grady, https://s3.amazonaws.com/uifaces/faces/twitter/lawlbwoy/128.jpg, Wed Nov 21 2012 00:28:56 GMT-0800 (PST), Enim et aperiam labore amet cum. Voluptatem temporibus id nihil natus velit qui recusandae beatae voluptatibus. Omnis neque ut explicabo laborum incidunt maiores. Placeat animi deleniti soluta dicta qui molestiae. Vel autem error alias pariatur ducimus hic magnam. Harum suscipit sit asperiores ex cum., 2, 5, 2, 3, 3, 5, 3
 784, 94, Dock, https://s3.amazonaws.com/uifaces/faces/twitter/flexrs/128.jpg, Thu Jan 28 2016 09:10:53 GMT-0800 (PST), Eos sed molestias et. Omnis eos magni. Suscipit aut est suscipit. Error aut voluptatum vero distinctio sequi accusamus optio., 4, 5, 1, 4, 4, 2, 5
 785, 40, Berry, https://s3.amazonaws.com/uifaces/faces/twitter/GavicoInd/128.jpg, Thu Dec 31 2015 02:04:49 GMT-0800 (PST), Nulla dolorum voluptas quo. Explicabo dolor ad et et ut et. Et molestias placeat et non rerum rerum. Et dolor esse quia consequuntur. Autem veniam sunt omnis non dolor quaerat voluptas. Vel earum enim rerum qui sed deleniti nemo non., 2, 2, 5, 2, 2, 3, 3
 786, 27, Jaden, https://s3.amazonaws.com/uifaces/faces/twitter/stephcoue/128.jpg, Wed Mar 21 2018 04:35:39 GMT-0700 (PDT), Nobis soluta suscipit est eos iste rem quidem ea. Sed ullam tempora blanditiis molestias qui quibusdam perspiciatis. Porro qui corrupti sint et delectus. Dolorum nemo accusamus totam molestiae amet tenetur facilis quaerat sed. Consequatur assumenda animi sint. Sit reprehenderit esse., 5, 2, 1, 5, 5, 3, 5
 787, 32, Lorenza, https://s3.amazonaws.com/uifaces/faces/twitter/antongenkin/128.jpg, Sat Sep 09 2017 11:36:15 GMT-0700 (PDT), Et aperiam quo provident eos. Consequatur debitis nemo aut quisquam est ut. Natus ut architecto debitis suscipit repellendus cum delectus. Iusto officia dolore culpa et dolor magni quis. Doloremque culpa sequi dolor reprehenderit nam et aut velit minima. Est enim sit non numquam dolor necessitatibus autem est fuga., 4, 2, 2, 1, 4, 2, 5
 788, 5, Margot, https://s3.amazonaws.com/uifaces/faces/twitter/saschadroste/128.jpg, Thu Mar 03 2011 19:55:30 GMT-0800 (PST), Quam earum a quia eaque deserunt autem minima nemo. Ut consequatur quia ea voluptates fugit. Hic consequatur pariatur quia. Id libero fugiat accusantium rerum qui at ut officiis esse., 1, 2, 2, 1, 4, 1, 1
 789, 71, Hollis, https://s3.amazonaws.com/uifaces/faces/twitter/aio___/128.jpg, Thu Aug 06 2015 22:38:45 GMT-0700 (PDT), Beatae et quia exercitationem earum veniam laborum et odio. Eos omnis et. Iure consequatur qui maiores omnis expedita quisquam id., 2, 5, 1, 4, 4, 5, 4
 790, 5, Glenda, https://s3.amazonaws.com/uifaces/faces/twitter/rickdt/128.jpg, Wed Jan 19 2011 04:00:41 GMT-0800 (PST), Et repellendus voluptatem sequi aut vitae amet sit. Veniam saepe distinctio magni vitae et reprehenderit. Aut assumenda vel tenetur sapiente., 2, 4, 2, 5, 2, 5, 5
 791, 60, Hubert, https://s3.amazonaws.com/uifaces/faces/twitter/gregrwilkinson/128.jpg, Mon Jan 19 2015 02:24:18 GMT-0800 (PST), Cum nulla consectetur et delectus odio at quo. Consequatur quia dolores possimus cumque. Accusamus suscipit sit velit odit earum itaque odio accusamus molestias., 1, 2, 5, 2, 4, 5, 2
 792, 18, Durward, https://s3.amazonaws.com/uifaces/faces/twitter/joelcipriano/128.jpg, Sat Jan 17 2015 09:25:37 GMT-0800 (PST), Et nisi ut quaerat odit necessitatibus voluptas. Autem vero aut et. Eveniet ab eum neque nobis est dolores dolore officia. Aut velit quas., 3, 2, 1, 1, 5, 4, 3
 793, 57, Zoie, https://s3.amazonaws.com/uifaces/faces/twitter/macxim/128.jpg, Mon Dec 21 2015 19:27:14 GMT-0800 (PST), Quam et et et. Delectus in in repellat corporis quos. Qui neque voluptatem veritatis dolores et. Et ea consectetur eos ad ducimus et., 5, 1, 5, 3, 4, 3, 5
 794, 55, Angie, https://s3.amazonaws.com/uifaces/faces/twitter/y2graphic/128.jpg, Thu Aug 04 2016 19:55:47 GMT-0700 (PDT), Molestias provident unde ut itaque. Aut voluptatum voluptas assumenda doloremque sit molestiae ut fuga totam. Sed fugiat ipsa et dolorum aperiam culpa. Veniam accusantium minus quos id vel harum eos natus mollitia. Repudiandae possimus qui qui natus et qui iure dolorum. Temporibus debitis maxime molestias natus perferendis quas accusamus esse sint., 3, 1, 5, 5, 2, 1, 5
 795, 14, Veda, https://s3.amazonaws.com/uifaces/faces/twitter/lowie/128.jpg, Sun Oct 24 2010 03:49:50 GMT-0700 (PDT), Ipsum dignissimos ratione. Dignissimos in ex mollitia debitis laborum qui sint aut. Est ea omnis suscipit placeat doloribus. Et vitae illo deleniti impedit ullam sint quisquam. Eveniet deserunt ea culpa., 4, 1, 1, 4, 1, 4, 5
 796, 30, Wilber, https://s3.amazonaws.com/uifaces/faces/twitter/beshur/128.jpg, Tue Dec 20 2011 00:29:06 GMT-0800 (PST), Mollitia et delectus totam. Quidem quisquam aut architecto autem et doloremque et. Atque molestias autem qui dolore. Vel debitis commodi., 3, 2, 2, 2, 2, 1, 4
 797, 34, Milford, https://s3.amazonaws.com/uifaces/faces/twitter/yecidsm/128.jpg, Sun Jan 10 2010 00:07:27 GMT-0800 (PST), Maiores aperiam quidem quo eum. At dolorum quis iusto nihil est maiores at. Earum accusamus dolor voluptas sed., 2, 4, 4, 5, 1, 5, 1
 798, 86, Aditya, https://s3.amazonaws.com/uifaces/faces/twitter/safrankov/128.jpg, Tue May 22 2012 10:38:12 GMT-0700 (PDT), Sed quisquam at dolor voluptatem iste. Et quia ullam sed ea id. Perferendis sint beatae autem quibusdam. Qui culpa voluptas enim est voluptas est eos animi. Quidem autem aliquam fugiat culpa iure maxime. Tempora necessitatibus nisi., 1, 4, 3, 1, 4, 2, 4
 799, 70, Theron, https://s3.amazonaws.com/uifaces/faces/twitter/ionuss/128.jpg, Sat Oct 02 2010 17:19:21 GMT-0700 (PDT), Dolores aliquid dolorum et laudantium cumque perspiciatis. Dolores ut libero consequatur similique voluptatem. Ut est optio inventore nemo est minus. Ut et et sapiente ullam illum ullam. Eaque modi amet quam quos hic rerum quas aut ratione. Et voluptatum consectetur quam., 4, 5, 5, 4, 3, 3, 3
 800, 53, Fredrick, https://s3.amazonaws.com/uifaces/faces/twitter/mattsapii/128.jpg, Fri Mar 25 2016 04:19:33 GMT-0700 (PDT), Et odit voluptatem eos illum est. Voluptate nam quidem. Amet delectus ex aut sapiente minima sed asperiores omnis. Consequuntur doloribus odit. Dolores sed sunt sed eum dolore est beatae., 1, 4, 1, 2, 5, 1, 1
 801, 30, Mertie, https://s3.amazonaws.com/uifaces/faces/twitter/a_brixen/128.jpg, Fri Oct 21 2011 14:21:38 GMT-0700 (PDT), Dolorum eos repudiandae iure delectus ut. Neque sunt omnis eos iusto aut et. Nobis consequatur sed cum., 3, 1, 2, 1, 4, 1, 4
 802, 46, Ezra, https://s3.amazonaws.com/uifaces/faces/twitter/thierrymeier_/128.jpg, Fri Aug 28 2015 04:00:18 GMT-0700 (PDT), Inventore nulla laborum fugiat ut ut consequatur error et quis. Voluptates illo rerum qui. Est qui quod quidem incidunt alias natus similique incidunt. In quam voluptates. Qui aliquid suscipit aliquid asperiores facilis voluptas. Accusamus sint aut voluptatibus est optio ut., 5, 4, 2, 1, 3, 1, 5
 803, 51, Myron, https://s3.amazonaws.com/uifaces/faces/twitter/soyjavi/128.jpg, Fri Mar 28 2014 20:11:05 GMT-0700 (PDT), Fugit et architecto laborum sit inventore numquam debitis natus. Ratione asperiores illo rem. Nihil voluptas aliquid et officiis. Tempora labore voluptas quis. Ducimus dolore odio est minus voluptas dolorem facere explicabo. Delectus veritatis fugit cum dolor rerum vero voluptatum., 3, 4, 1, 1, 4, 3, 3
 804, 24, Dalton, https://s3.amazonaws.com/uifaces/faces/twitter/a1chapone/128.jpg, Wed Aug 09 2017 08:54:29 GMT-0700 (PDT), Culpa aut sequi molestiae suscipit iste vel ullam et. Voluptatum praesentium aliquam. Quaerat laboriosam incidunt odio sit rerum necessitatibus minima esse. Voluptatem odit quo quia quis fugiat. Optio fugit dolor nostrum ducimus temporibus temporibus. Quia et aliquam ea dolores blanditiis., 5, 5, 3, 2, 1, 3, 3
 805, 8, Rolando, https://s3.amazonaws.com/uifaces/faces/twitter/xtopherpaul/128.jpg, Sun Apr 22 2012 05:34:08 GMT-0700 (PDT), Tempora quidem eaque et rerum corporis suscipit pariatur. Corporis tenetur in asperiores exercitationem odit quidem. Quidem voluptatem et., 4, 3, 4, 5, 2, 4, 3
 806, 42, Agustina, https://s3.amazonaws.com/uifaces/faces/twitter/vijaykarthik/128.jpg, Tue Aug 31 2010 17:32:24 GMT-0700 (PDT), Quia aut iure eos facilis. Quisquam commodi aut eius. Assumenda aut consequatur voluptate non rerum quas facere sunt aut. Quia quis veniam aut. Dolorem omnis ullam consequuntur officia reiciendis et quia aut labore., 5, 2, 5, 1, 2, 3, 4
 807, 31, Malvina, https://s3.amazonaws.com/uifaces/faces/twitter/mslarkina/128.jpg, Thu Sep 18 2014 23:56:39 GMT-0700 (PDT), Non non quia. Aut rerum eos eligendi beatae reiciendis sint officiis qui. Qui quia laudantium atque qui nihil nobis. Iure mollitia magni ex architecto unde quod. Enim quia ut quia sed quis. Vel ipsum nesciunt., 1, 5, 4, 1, 4, 5, 5
 808, 39, Gerson, https://s3.amazonaws.com/uifaces/faces/twitter/ah_lice/128.jpg, Thu Mar 30 2017 06:57:29 GMT-0700 (PDT), Tempora suscipit et qui odio sequi. Nisi nam hic sit. Eos aut vitae excepturi et optio labore ullam. Numquam ut provident est iure., 2, 5, 5, 4, 2, 4, 3
