id, roomId, userName, img, date, review, overall, accuracy, communication, cleanliness, location, checkin, value
 1, 9, Stone, https://s3.amazonaws.com/uifaces/faces/twitter/dmitriychuta/128.jpg, Fri Feb 07 2014 03:01:13 GMT-0800 (PST), Aperiam in sit. Alias voluptatem vitae impedit molestiae illum aliquid blanditiis fugiat. Voluptatem et et consequatur id rerum nulla sequi rem. Qui sed excepturi nobis voluptas ad blanditiis eaque qui., 3, 2, 4, 2, 1, 2, 1
 2, 76, Jovany, https://s3.amazonaws.com/uifaces/faces/twitter/coderdiaz/128.jpg, Thu Sep 01 2011 00:36:03 GMT-0700 (PDT), Non ipsam consequuntur recusandae voluptatem voluptate quae accusantium. Ea ea vitae minima ullam quam et aut. Sint ab voluptas necessitatibus accusamus excepturi. Omnis adipisci alias consectetur doloremque et et distinctio. Est voluptatem ipsum dolore omnis et ipsa assumenda odit id., 2, 2, 1, 2, 2, 5, 3
 3, 2, Gerda, https://s3.amazonaws.com/uifaces/faces/twitter/vanchesz/128.jpg, Fri Nov 29 2013 18:50:02 GMT-0800 (PST), Similique fugit nam amet dolorem soluta sed possimus magni. Eaque ad dolores ipsam aut asperiores. Nemo eos commodi sunt tempora ad voluptatem et modi vitae. Tempora est temporibus et dolore eius non voluptas ut voluptate. Asperiores voluptatum inventore ad aliquid animi ut., 3, 4, 2, 1, 3, 2, 5
 4, 1, Rodger, https://s3.amazonaws.com/uifaces/faces/twitter/dgajjar/128.jpg, Wed Jan 05 2011 13:50:55 GMT-0800 (PST), Aperiam laudantium officia voluptatum molestiae ut. Facilis sed eos vero quia. Assumenda possimus ipsa libero deserunt ut distinctio maxime. Saepe qui sapiente sit est., 4, 5, 3, 3, 3, 3, 1
 5, 40, Theodora, https://s3.amazonaws.com/uifaces/faces/twitter/flexrs/128.jpg, Mon May 28 2012 05:22:43 GMT-0700 (PDT), Corrupti fuga velit illum mollitia velit nisi nesciunt omnis non. Saepe expedita quia. Vel autem ducimus aspernatur consequatur. Quidem qui maiores sed ea fugit voluptatibus necessitatibus aut., 3, 2, 1, 2, 5, 1, 3
 6, 25, Chelsey, https://s3.amazonaws.com/uifaces/faces/twitter/joelcipriano/128.jpg, Sun Jun 19 2016 08:27:37 GMT-0700 (PDT), Quam architecto quo totam velit numquam iusto nam exercitationem. Pariatur et debitis. Aliquid autem voluptas qui ut. Omnis doloremque quia impedit qui aliquam., 3, 3, 1, 1, 3, 3, 5
 7, 53, Braeden, https://s3.amazonaws.com/uifaces/faces/twitter/sunshinedgirl/128.jpg, Fri Aug 08 2014 03:55:42 GMT-0700 (PDT), Et veritatis ratione nostrum impedit voluptatibus et ut. Cupiditate dolore unde sit eveniet. Expedita est accusamus laudantium nobis magnam ea unde ad in. Nihil asperiores assumenda soluta minus quaerat., 3, 2, 4, 5, 1, 4, 1
 8, 10, Nathen, https://s3.amazonaws.com/uifaces/faces/twitter/el_fuertisimo/128.jpg, Sat Aug 22 2015 17:47:17 GMT-0700 (PDT), Distinctio exercitationem aut. Et qui qui exercitationem dolor sit dicta et omnis sint. Numquam error praesentium earum. Soluta quam nisi aut ducimus molestias qui voluptatum dolorem. Similique nemo quisquam autem unde reprehenderit aliquid., 4, 1, 4, 4, 3, 5, 3
 9, 95, Rodger, https://s3.amazonaws.com/uifaces/faces/twitter/laurengray/128.jpg, Sun May 28 2017 20:58:00 GMT-0700 (PDT), Totam incidunt ut magni rerum at. Totam assumenda dolor. Officia ipsum a recusandae corporis omnis officia. Eum ut adipisci voluptate. Repellendus minima ullam itaque est quia ex iste. Voluptate quae in reprehenderit aspernatur et animi., 4, 1, 5, 4, 2, 1, 1
 10, 32, Lafayette, https://s3.amazonaws.com/uifaces/faces/twitter/judzhin_miles/128.jpg, Mon Sep 07 2015 04:44:35 GMT-0700 (PDT), Velit quae accusamus quis rerum iusto. Ut neque qui quod cumque quia. Ullam odit optio deleniti et qui nemo., 5, 1, 3, 3, 4, 2, 4
 11, 29, Estefania, https://s3.amazonaws.com/uifaces/faces/twitter/vicivadeline/128.jpg, Tue Nov 17 2015 19:50:51 GMT-0800 (PST), Consequuntur non iure labore suscipit dolore non quia hic modi. Omnis aut aut autem id. Id maxime sit. Rerum aut nemo velit est facilis rerum soluta. Et impedit voluptatem omnis sed possimus., 1, 1, 3, 5, 1, 3, 2
 12, 88, Bella, https://s3.amazonaws.com/uifaces/faces/twitter/karthipanraj/128.jpg, Tue Aug 20 2013 02:31:53 GMT-0700 (PDT), Et vero quas facere veniam aut blanditiis voluptas. Pariatur voluptatem ex autem. Rerum voluptatem officia est nihil reprehenderit. Iusto similique doloribus. Tenetur exercitationem sit sint voluptatem non sit. Dicta natus repellat adipisci autem qui nemo illum., 3, 4, 1, 5, 1, 2, 5
 13, 54, Julius, https://s3.amazonaws.com/uifaces/faces/twitter/mattdetails/128.jpg, Sun Jul 04 2010 14:04:02 GMT-0700 (PDT), Officiis repellat libero quasi illum sit vero similique velit. Quis et unde modi fugit nemo. Quod harum ea voluptatibus. Ad expedita et autem provident autem. Architecto deserunt omnis. Rerum aut nisi eum atque a., 5, 4, 2, 4, 3, 1, 2
 14, 43, Leonie, https://s3.amazonaws.com/uifaces/faces/twitter/andresdjasso/128.jpg, Fri Jun 29 2012 04:43:14 GMT-0700 (PDT), Harum iusto atque omnis cumque sed. Id neque consequatur optio voluptatem recusandae distinctio. Sed eaque quidem culpa. Cupiditate necessitatibus reprehenderit velit quaerat ad. Id illum perferendis architecto sint., 3, 3, 5, 5, 4, 4, 1
 15, 63, Adolf, https://s3.amazonaws.com/uifaces/faces/twitter/grrr_nl/128.jpg, Sat Jun 23 2018 16:48:29 GMT-0700 (PDT), Sequi voluptatem quis est consequatur aut quia ut minus. Ut debitis id aliquid sequi debitis accusantium aspernatur eveniet. Minima dolor velit quo libero sit quisquam., 1, 1, 2, 3, 2, 2, 5
 16, 31, Roma, https://s3.amazonaws.com/uifaces/faces/twitter/duivvv/128.jpg, Thu Oct 11 2012 21:05:09 GMT-0700 (PDT), Voluptatem qui veniam. Rerum atque omnis enim delectus. Alias nobis et. Laudantium qui dolorem., 5, 4, 4, 4, 2, 5, 1
 17, 85, Keyshawn, https://s3.amazonaws.com/uifaces/faces/twitter/ciaranr/128.jpg, Sun Feb 23 2014 03:07:12 GMT-0800 (PST), Animi aliquam aliquam iusto ad nobis saepe accusamus tempora. Qui debitis at voluptas enim in. Sint voluptatem eos qui praesentium recusandae laudantium reiciendis quae. Iusto repudiandae itaque optio magni natus dolores dolores temporibus libero. Dolorum ex eius et excepturi omnis velit qui impedit. Pariatur unde minima ut quia., 4, 3, 5, 3, 3, 2, 2
 18, 51, Imelda, https://s3.amazonaws.com/uifaces/faces/twitter/millinet/128.jpg, Fri Feb 24 2017 18:55:25 GMT-0800 (PST), Itaque eligendi non et deserunt nihil odio velit. Neque labore eum autem odit ut et necessitatibus aperiam. A nostrum molestias porro dolores. Est voluptas labore temporibus. Voluptatibus laborum recusandae sint facere quia minus., 3, 3, 2, 4, 1, 4, 2
 19, 26, Sandra, https://s3.amazonaws.com/uifaces/faces/twitter/gonzalorobaina/128.jpg, Thu Aug 23 2012 09:42:47 GMT-0700 (PDT), Voluptatem et nihil accusantium et sequi ratione nihil accusamus ut. Reiciendis temporibus minima alias. Voluptatem consectetur repellendus consequatur ab harum earum. Quam numquam atque velit officia non., 3, 5, 3, 3, 2, 2, 3
 20, 96, Kristy, https://s3.amazonaws.com/uifaces/faces/twitter/popey/128.jpg, Sun Jan 22 2012 23:34:03 GMT-0800 (PST), Est molestiae quia. Quia facere eum voluptatum praesentium nostrum. Perferendis rerum corporis est voluptas. Dignissimos maxime architecto natus fugit rerum laboriosam. Consequatur amet voluptates assumenda consectetur minima quisquam sed rerum perferendis., 5, 5, 2, 2, 3, 5, 2
 21, 22, Tyrese, https://s3.amazonaws.com/uifaces/faces/twitter/abdots/128.jpg, Thu Feb 16 2012 04:11:53 GMT-0800 (PST), Exercitationem sed sint quaerat aliquam itaque voluptate eaque qui. Et tempore et doloremque nesciunt unde libero deleniti error maiores. Tenetur et cupiditate nemo mollitia porro., 3, 1, 1, 5, 5, 2, 5
 22, 28, Floy, https://s3.amazonaws.com/uifaces/faces/twitter/evanshajed/128.jpg, Sat Nov 29 2014 12:59:54 GMT-0800 (PST), Ut facere neque nemo aut sunt earum ut reiciendis consectetur. Ut officia quo qui quo quo odit in molestiae sunt. Quibusdam voluptatibus omnis earum laborum perspiciatis non voluptatem. Illum eum amet., 5, 4, 5, 1, 2, 3, 4
 23, 56, Orville, https://s3.amazonaws.com/uifaces/faces/twitter/johannesneu/128.jpg, Thu Jan 12 2012 02:23:51 GMT-0800 (PST), Soluta incidunt commodi sit fugit quidem aspernatur quisquam nemo. Libero accusantium blanditiis ab recusandae error et excepturi quia excepturi. Sapiente eaque aut provident sint sit ut qui. Culpa optio commodi placeat eos. Quia recusandae nesciunt esse necessitatibus quia quae earum. Veritatis ipsum exercitationem cumque porro aut ut quasi., 5, 5, 2, 1, 5, 1, 5
 24, 100, Keyon, https://s3.amazonaws.com/uifaces/faces/twitter/justinrob/128.jpg, Fri Dec 15 2017 01:48:14 GMT-0800 (PST), Ea sunt exercitationem labore reprehenderit. Sapiente necessitatibus quia at atque qui et architecto aspernatur. Recusandae sed unde soluta. Harum voluptatibus non quidem maxime praesentium fugiat nihil. Aut et illum. Sint facere reprehenderit illum ea a non repellat., 2, 1, 3, 1, 2, 1, 1
 25, 30, Bethany, https://s3.amazonaws.com/uifaces/faces/twitter/ssiskind/128.jpg, Sat Jan 05 2013 01:45:31 GMT-0800 (PST), Quia sit eos mollitia nihil sit deserunt hic quo. Dicta sint sed. Consequatur ut eum. Adipisci temporibus delectus maiores., 2, 2, 4, 1, 1, 1, 3
 26, 27, Clifford, https://s3.amazonaws.com/uifaces/faces/twitter/BryanHorsey/128.jpg, Wed Oct 28 2015 05:15:09 GMT-0700 (PDT), Quo veniam quia incidunt reprehenderit similique aut officia quae. Fugiat excepturi consequatur sit vitae delectus eos. Est et illum in asperiores doloribus velit non rem minus. Est autem est est., 3, 5, 2, 1, 4, 1, 2
 27, 59, Rubye, https://s3.amazonaws.com/uifaces/faces/twitter/falvarad/128.jpg, Thu Jan 26 2017 07:39:34 GMT-0800 (PST), Ratione debitis nihil amet totam hic veritatis. Voluptate dolorum adipisci ut iusto doloribus. Commodi et corrupti laborum labore expedita optio consequatur. Animi non est mollitia autem ratione. Et praesentium omnis. Et autem est., 3, 2, 3, 4, 1, 4, 3
 28, 18, Jaiden, https://s3.amazonaws.com/uifaces/faces/twitter/raquelwilson/128.jpg, Wed Oct 29 2014 16:03:14 GMT-0700 (PDT), Repellat occaecati quo quis consequatur sit dolores rerum nihil. Quis illum omnis aut dolorum omnis minus illo. Repellat voluptatem deserunt vitae ut et. Dolore vitae delectus pariatur molestias ab omnis cupiditate magni quis. Id rerum quibusdam error quam vel quia quisquam., 5, 2, 1, 1, 1, 2, 1
 29, 18, Lionel, https://s3.amazonaws.com/uifaces/faces/twitter/nfedoroff/128.jpg, Thu Dec 14 2017 20:30:35 GMT-0800 (PST), Vel qui quia praesentium. Et qui sit nihil. Qui numquam vel ut delectus voluptates nihil maxime. Dolor reiciendis eos quia atque. Facilis maxime aut nihil assumenda nam. Reiciendis sint molestiae qui veniam., 5, 4, 1, 3, 3, 4, 4
 30, 21, Aurelie, https://s3.amazonaws.com/uifaces/faces/twitter/scrapdnb/128.jpg, Mon Sep 19 2011 01:43:43 GMT-0700 (PDT), Dolore et et est optio exercitationem iure nam est autem. Consectetur inventore nemo et et aperiam enim esse facilis ab. Quasi atque ullam nulla saepe. Libero perferendis sed in autem voluptas quas occaecati cupiditate., 2, 2, 1, 4, 4, 3, 4
 31, 71, Zane, https://s3.amazonaws.com/uifaces/faces/twitter/sweetdelisa/128.jpg, Tue Feb 04 2014 06:32:11 GMT-0800 (PST), Fuga sint fuga fugit in voluptatem ipsum. Itaque quam sit maxime aut. Similique voluptas sed mollitia asperiores. Omnis qui illum debitis doloremque eius. Provident maxime quaerat et sit officia vel repellat quia et., 1, 4, 2, 2, 1, 5, 3
 32, 66, Kenton, https://s3.amazonaws.com/uifaces/faces/twitter/andrewofficer/128.jpg, Sun Dec 19 2010 16:16:28 GMT-0800 (PST), Id distinctio ea consequatur doloremque aut ab nemo facere sed. Quaerat et qui fuga consequatur officia perspiciatis molestiae. Quas et unde et provident non ullam architecto consequuntur id. Similique cumque placeat maiores optio molestiae., 5, 3, 5, 1, 4, 5, 1
 33, 53, Adell, https://s3.amazonaws.com/uifaces/faces/twitter/dhilipsiva/128.jpg, Wed Apr 20 2016 03:40:29 GMT-0700 (PDT), Eum provident maxime magni expedita sed ipsa eveniet eaque. Praesentium ea velit labore est. In assumenda vel aliquam enim aut. Iure et delectus et est iusto assumenda a nemo. Quo iure sapiente voluptas non aut vel maiores., 2, 4, 5, 3, 3, 3, 4
 34, 88, Ned, https://s3.amazonaws.com/uifaces/faces/twitter/pmeissner/128.jpg, Sat Apr 18 2015 22:35:22 GMT-0700 (PDT), Eaque illo eum eaque aut necessitatibus eaque reprehenderit aspernatur maxime. Facere veniam similique rerum maiores nihil placeat voluptas a non. Unde iure qui quia itaque nulla. Eius ipsum aut saepe porro. Blanditiis asperiores omnis qui quos numquam quaerat sapiente., 5, 3, 5, 1, 5, 4, 1
 35, 10, Sienna, https://s3.amazonaws.com/uifaces/faces/twitter/nelshd/128.jpg, Sat Nov 27 2010 15:53:20 GMT-0800 (PST), Numquam doloribus et. Quia ut eos molestiae officiis consequuntur aliquam. Beatae itaque expedita sit. Alias exercitationem accusamus voluptatem suscipit totam nostrum fuga soluta fugiat. Perspiciatis praesentium et aliquam vel autem., 4, 1, 2, 1, 2, 5, 4
 36, 7, Myah, https://s3.amazonaws.com/uifaces/faces/twitter/stayuber/128.jpg, Wed Apr 01 2015 16:55:25 GMT-0700 (PDT), Quis repellat consequatur atque aperiam corporis voluptates dolore. Voluptas ut aut similique omnis earum vitae non deserunt. Minima ipsum dolorum natus rerum magnam dolores quidem. Ea non et. Delectus voluptate ad numquam est pariatur sed sed. Doloremque et et expedita sed modi voluptatum laudantium optio dicta., 2, 3, 1, 3, 3, 2, 1
 37, 77, Aniyah, https://s3.amazonaws.com/uifaces/faces/twitter/sawalazar/128.jpg, Mon Oct 04 2010 14:32:56 GMT-0700 (PDT), Eos sit qui. Odit rerum quisquam est quaerat in atque possimus. Vero repudiandae dicta provident. Debitis expedita commodi rerum in odio qui et totam magni. Rem sequi aperiam omnis., 2, 3, 1, 4, 1, 1, 4
 38, 56, Katlyn, https://s3.amazonaws.com/uifaces/faces/twitter/soffes/128.jpg, Wed Aug 03 2011 13:45:42 GMT-0700 (PDT), Ex aspernatur quo iure perspiciatis et. Hic suscipit explicabo consequatur numquam repellendus. Commodi nisi sit quam aut et. Dolorum voluptatibus perspiciatis vero rem repellat quis vitae eos vitae., 2, 1, 1, 3, 5, 4, 5
 39, 81, Kiana, https://s3.amazonaws.com/uifaces/faces/twitter/sunlandictwin/128.jpg, Sat Nov 09 2013 09:45:58 GMT-0800 (PST), Sint est tempora expedita dolor quo laborum. Molestias aliquid accusamus voluptatem consequuntur voluptates. Quisquam quia dolore alias adipisci neque voluptas aut autem minima. Et iusto aliquam pariatur et inventore nostrum quas voluptate., 1, 4, 5, 2, 5, 2, 5
 40, 21, Axel, https://s3.amazonaws.com/uifaces/faces/twitter/nckjrvs/128.jpg, Wed Jan 20 2016 18:20:33 GMT-0800 (PST), Quod corrupti quia quis rerum veritatis est aut. Est consequatur maxime ex laborum alias explicabo sint eaque. Assumenda et qui est ut enim impedit enim. Autem doloribus laudantium sit minima blanditiis alias est praesentium ut., 2, 2, 2, 2, 5, 5, 4
 41, 46, Rebekah, https://s3.amazonaws.com/uifaces/faces/twitter/martip07/128.jpg, Wed May 03 2017 10:10:18 GMT-0700 (PDT), Consequatur rerum debitis eveniet. Suscipit ad consequuntur sit eligendi et sapiente. Quas omnis totam placeat molestiae., 3, 4, 2, 2, 4, 5, 2
 42, 60, Leonora, https://s3.amazonaws.com/uifaces/faces/twitter/cboller1/128.jpg, Mon Jun 08 2015 21:20:52 GMT-0700 (PDT), Cupiditate cum voluptatem eaque qui consequatur. Esse velit maxime doloremque magnam quos voluptate. Minus et ratione quae dolorem nihil. Optio magni possimus est et modi qui. Quibusdam ipsam dicta dolorum voluptatum quis itaque repellendus ea delectus., 3, 2, 2, 4, 5, 3, 4
 43, 13, Tiana, https://s3.amazonaws.com/uifaces/faces/twitter/isacosta/128.jpg, Tue Aug 30 2011 15:42:49 GMT-0700 (PDT), Sapiente dolorem culpa quidem explicabo vitae vel non porro enim. Aut sed dolorem consequatur ullam rerum ut hic nihil. Quis libero similique sed alias dolor provident. At impedit omnis aut nulla fugiat incidunt non quam. Commodi harum deleniti illum molestias porro eaque., 1, 2, 2, 4, 2, 2, 4
 44, 8, Ewald, https://s3.amazonaws.com/uifaces/faces/twitter/nessoila/128.jpg, Sun Jul 13 2014 07:27:21 GMT-0700 (PDT), Voluptas sed qui sit laudantium reprehenderit hic sit. Nostrum blanditiis a inventore libero nemo velit aspernatur qui. Dolores doloribus optio assumenda. Fuga consequuntur quam eum. Sequi eos a quis laborum non., 5, 4, 2, 2, 4, 3, 4
 45, 72, Ardella, https://s3.amazonaws.com/uifaces/faces/twitter/herrhaase/128.jpg, Sat Oct 25 2014 22:00:02 GMT-0700 (PDT), Consequatur omnis eum. Et est ducimus voluptates amet dolorem. Quod quisquam aut illo expedita rem velit. Magnam eum illum et aliquid eius harum in ullam., 2, 3, 2, 4, 1, 5, 4
 46, 7, Frieda, https://s3.amazonaws.com/uifaces/faces/twitter/amayvs/128.jpg, Sat Aug 06 2011 06:04:32 GMT-0700 (PDT), Cum soluta reiciendis. Porro quae maiores. Qui dignissimos soluta ipsum quos consectetur nam nostrum doloribus aperiam. Quia molestiae magnam., 5, 4, 3, 5, 4, 5, 4
 47, 51, Ebba, https://s3.amazonaws.com/uifaces/faces/twitter/arpitnj/128.jpg, Fri Jul 02 2010 14:53:58 GMT-0700 (PDT), Debitis quisquam debitis mollitia distinctio dolor delectus ut ipsum. Porro mollitia ut blanditiis qui saepe aut et. Perspiciatis illum quaerat enim voluptatem quam aperiam voluptas porro consequuntur. Sequi pariatur magnam accusantium consequatur ea quis., 5, 1, 3, 5, 5, 1, 1
 48, 1, Ernestine, https://s3.amazonaws.com/uifaces/faces/twitter/juaumlol/128.jpg, Thu Jul 12 2018 09:52:04 GMT-0700 (PDT), Quae dolorem reiciendis molestias et aliquid ducimus aut. Unde assumenda sed voluptas labore qui sunt qui. Velit ut voluptate suscipit mollitia vel., 1, 3, 3, 1, 2, 2, 5
 49, 4, Ronny, https://s3.amazonaws.com/uifaces/faces/twitter/juaumlol/128.jpg, Tue Sep 29 2015 10:09:54 GMT-0700 (PDT), Exercitationem quia ipsum assumenda. Fugit ut iusto qui sed similique dolor saepe. Voluptatum quisquam voluptas dicta. Ut ipsa suscipit et. Id consequuntur et est suscipit exercitationem recusandae nostrum. Consequuntur expedita nemo non tempore totam sit illum., 5, 1, 5, 2, 5, 4, 2
 50, 27, Tressie, https://s3.amazonaws.com/uifaces/faces/twitter/gaborenton/128.jpg, Tue Mar 08 2016 10:02:47 GMT-0800 (PST), Ad ipsa aspernatur iusto dolor voluptas exercitationem et qui id. Velit illo porro quis occaecati nemo consequatur. Pariatur voluptate amet voluptatem non officia voluptate dicta. Perspiciatis occaecati cupiditate et vel et asperiores voluptatum quia. Nihil sint est ab dolores sapiente inventore aut soluta doloremque. Dicta voluptatem sunt consequatur aut ut at non et., 3, 3, 3, 4, 4, 4, 2
 51, 74, Maudie, https://s3.amazonaws.com/uifaces/faces/twitter/kaysix_dizzy/128.jpg, Thu Jul 03 2014 11:49:27 GMT-0700 (PDT), Sapiente suscipit doloribus earum. Voluptate quis ut iste fuga consequatur blanditiis. Velit sunt maiores. Id iure amet. Vel perspiciatis dolorem alias voluptas eos quis., 5, 3, 1, 4, 1, 3, 4
 52, 99, Nicole, https://s3.amazonaws.com/uifaces/faces/twitter/pierrestoffe/128.jpg, Tue Jun 13 2017 18:05:48 GMT-0700 (PDT), Veritatis et quam similique tenetur nulla molestias facilis corrupti tempore. Est eaque in sit eum aliquam qui doloribus natus. Quae commodi tempore voluptatibus neque delectus voluptatibus dolor quaerat. Excepturi nihil sit id aut magnam id ipsa quos dolorem. Repellat laboriosam reprehenderit facilis quo velit praesentium. Consequatur tempora suscipit., 1, 4, 1, 2, 5, 5, 4
 53, 62, Kennedi, https://s3.amazonaws.com/uifaces/faces/twitter/dudestein/128.jpg, Wed Jan 08 2014 15:24:33 GMT-0800 (PST), Consequuntur aut numquam et. Esse similique consequatur. Necessitatibus placeat necessitatibus eos id ea eligendi perferendis omnis., 2, 1, 3, 3, 3, 3, 1
 54, 100, Clemens, https://s3.amazonaws.com/uifaces/faces/twitter/kinday/128.jpg, Wed Mar 16 2011 20:27:06 GMT-0700 (PDT), Maiores officia id vel et sint optio eos provident. Voluptatem adipisci sed et vero. Accusamus officiis hic repellendus eos iusto eaque consequatur vel. Vero vero rerum esse iste., 1, 4, 1, 3, 1, 1, 1
 55, 33, Nestor, https://s3.amazonaws.com/uifaces/faces/twitter/wesleytrankin/128.jpg, Sun Apr 29 2012 07:06:15 GMT-0700 (PDT), Libero esse optio harum porro quae id. Non adipisci magni esse nobis dolorum. Quis fuga voluptates sequi perferendis et et. Corrupti sequi quam nisi porro dolores., 4, 3, 1, 4, 1, 4, 3
 56, 46, Santino, https://s3.amazonaws.com/uifaces/faces/twitter/carlfairclough/128.jpg, Sun Dec 31 2017 20:24:31 GMT-0800 (PST), Ut amet aperiam explicabo. Dignissimos sunt expedita exercitationem. Quod repellat quo dicta doloribus ratione ut non. Consequatur qui autem quae., 4, 4, 4, 2, 3, 4, 4
 57, 88, Rowland, https://s3.amazonaws.com/uifaces/faces/twitter/cbracco/128.jpg, Thu Aug 22 2013 22:53:58 GMT-0700 (PDT), Est libero sit distinctio nihil aut nulla ea totam ut. Ullam rerum voluptates illo tempore dolor et voluptas et pariatur. Repellendus tempore dolor non deleniti nobis ut vel itaque perferendis. Dignissimos quae at adipisci eligendi et vitae vero consequatur. Maiores doloribus occaecati officia omnis aspernatur., 2, 4, 3, 2, 3, 2, 1
 58, 51, Godfrey, https://s3.amazonaws.com/uifaces/faces/twitter/anaami/128.jpg, Sun Apr 21 2013 20:12:09 GMT-0700 (PDT), Temporibus minus sunt itaque autem quod commodi omnis. Enim atque qui unde voluptatem. Sunt quod aliquam quisquam dicta placeat odit reiciendis sint et., 2, 5, 5, 1, 2, 4, 4
 59, 17, Allan, https://s3.amazonaws.com/uifaces/faces/twitter/finchjke/128.jpg, Wed Mar 09 2011 14:13:18 GMT-0800 (PST), Dolore sint minus. Quia aspernatur doloribus nesciunt vero rerum temporibus sed. Vel ut ipsa voluptates praesentium. Unde voluptatum ut consectetur aut velit ex sint. Minima qui soluta eos., 3, 1, 4, 1, 3, 4, 2
 60, 64, Gladys, https://s3.amazonaws.com/uifaces/faces/twitter/nastya_mane/128.jpg, Tue Mar 24 2015 20:20:59 GMT-0700 (PDT), Enim et perspiciatis ut impedit vel. Dolor molestiae quia culpa iure nobis. Nihil necessitatibus ex debitis cupiditate accusantium qui. Nam harum accusantium maxime animi delectus consectetur et. Alias optio fugiat quis quibusdam dignissimos et nesciunt., 4, 1, 5, 3, 2, 5, 2
 61, 7, Hobart, https://s3.amazonaws.com/uifaces/faces/twitter/millinet/128.jpg, Sat Dec 20 2014 01:29:56 GMT-0800 (PST), Necessitatibus aliquam et maiores quia laborum quis accusantium. Illo sed facilis. Expedita omnis voluptates., 4, 3, 5, 2, 3, 5, 1
 62, 96, Kari, https://s3.amazonaws.com/uifaces/faces/twitter/denisepires/128.jpg, Wed May 09 2012 21:46:21 GMT-0700 (PDT), Consequatur voluptatem laudantium non consequuntur iste dicta velit sed mollitia. Sint excepturi molestias. Laborum a accusamus quam sapiente nisi sequi., 4, 2, 1, 1, 3, 4, 2
 63, 99, Alessandra, https://s3.amazonaws.com/uifaces/faces/twitter/mattdetails/128.jpg, Sun Feb 09 2014 23:01:38 GMT-0800 (PST), Nam velit ut tempora quo aut et. Id sequi animi quos reiciendis porro quisquam sunt. Aut et et iure corporis quia earum quod. Deleniti voluptatum ex voluptas dignissimos consequatur qui dolor earum non. Saepe pariatur sed velit qui ducimus ea sapiente eaque quae. Ut voluptate exercitationem molestiae vel id quia., 1, 4, 1, 5, 3, 5, 4
 64, 66, Chadd, https://s3.amazonaws.com/uifaces/faces/twitter/oksanafrewer/128.jpg, Sat Aug 02 2014 01:52:19 GMT-0700 (PDT), Quo dolor et cumque perferendis. Eos aspernatur inventore qui. Quis cum molestiae autem voluptas. Qui ea a voluptas et ad perferendis porro qui modi., 2, 3, 1, 2, 5, 4, 1
 65, 21, Joesph, https://s3.amazonaws.com/uifaces/faces/twitter/kushsolitary/128.jpg, Sun Feb 15 2015 11:39:08 GMT-0800 (PST), Quasi rerum et quibusdam itaque magnam saepe adipisci mollitia beatae. Ut eveniet temporibus aliquam molestias quam itaque tenetur voluptatem. Occaecati aperiam nesciunt ducimus. Aut omnis omnis sit voluptate optio., 4, 2, 1, 1, 3, 5, 4
 66, 7, Millie, https://s3.amazonaws.com/uifaces/faces/twitter/allthingssmitty/128.jpg, Mon Dec 05 2016 19:24:15 GMT-0800 (PST), Perferendis qui nesciunt molestiae nam ut reprehenderit occaecati veritatis voluptatem. Amet ut earum voluptas similique quia reiciendis eos animi quisquam. Quia dolorem voluptatem ipsa debitis. Consequatur et quis iste non asperiores hic vero., 3, 4, 4, 5, 4, 3, 5
 67, 13, Tiara, https://s3.amazonaws.com/uifaces/faces/twitter/vj_demien/128.jpg, Mon Mar 25 2013 13:27:47 GMT-0700 (PDT), Qui doloribus voluptates et earum magni dicta et veritatis qui. Natus rerum numquam praesentium accusamus tempore et at. Deleniti molestiae qui officiis quo dolores. Qui aut sed minima dolorum. Corporis aut quia cupiditate sed beatae libero. Eum pariatur ad iste reprehenderit qui ea facilis., 3, 5, 5, 5, 4, 3, 5
 68, 46, Hunter, https://s3.amazonaws.com/uifaces/faces/twitter/salleedesign/128.jpg, Thu Dec 26 2013 21:50:05 GMT-0800 (PST), Eum earum blanditiis suscipit et. Enim voluptas vero sint quaerat harum et voluptas. Quaerat non nisi eveniet quia aperiam similique ut. Eos quia tenetur omnis aut qui repellat., 1, 2, 4, 1, 3, 3, 2
 69, 39, Cornell, https://s3.amazonaws.com/uifaces/faces/twitter/the_winslet/128.jpg, Fri Jun 20 2014 06:44:10 GMT-0700 (PDT), Tempore aspernatur ut dolorem voluptatem dolores voluptatem voluptas voluptatem. Aliquam quos suscipit eaque ut ut sed atque. Alias quo minus sunt. Dolore aut quia et laborum ratione. Est id harum., 3, 5, 4, 2, 3, 1, 3
 70, 43, Noe, https://s3.amazonaws.com/uifaces/faces/twitter/therealmarvin/128.jpg, Mon Oct 10 2011 07:08:48 GMT-0700 (PDT), Consequatur at non aut odit magnam. Eligendi quia laboriosam mollitia. Iusto eveniet iure excepturi expedita ut. Ut sunt nihil consequatur iure necessitatibus et est est provident. Eos eius animi illum possimus fugiat voluptates quia., 5, 5, 1, 5, 2, 1, 4
 71, 29, Everardo, https://s3.amazonaws.com/uifaces/faces/twitter/Chakintosh/128.jpg, Thu Sep 03 2015 19:33:54 GMT-0700 (PDT), Quo repellendus iste temporibus sequi fuga ut omnis. Nesciunt cum quaerat. Rerum porro odio fugit neque. Inventore ut asperiores rerum sunt eum et ducimus sint maxime. Libero odit blanditiis., 5, 5, 3, 1, 4, 1, 1
