 367, 45, Demetrius, https://s3.amazonaws.com/uifaces/faces/twitter/stefanotirloni/128.jpg, Sat Nov 20 2010 06:14:45 GMT-0800 (PST), In aut dolor aspernatur minus in asperiores nostrum. Sapiente voluptatum deserunt reprehenderit facere ea doloremque et explicabo et. Rerum temporibus ut reprehenderit debitis vel consequuntur molestiae. In molestiae asperiores aut sit est consequatur similique quam maxime., 3, 3, 1, 1, 1, 3, 1
 368, 5, Lisette, https://s3.amazonaws.com/uifaces/faces/twitter/jydesign/128.jpg, Fri Oct 14 2016 13:42:34 GMT-0700 (PDT), Eos rerum vitae dolor quo vel debitis est. Iusto consequatur et repellendus ea eos. Nulla aut libero laborum temporibus aperiam illum. Inventore est sequi laudantium unde voluptatibus facilis sit. Neque molestiae ratione est soluta ad., 5, 3, 4, 4, 2, 4, 2
 369, 34, Desiree, https://s3.amazonaws.com/uifaces/faces/twitter/jffgrdnr/128.jpg, Sat Dec 24 2016 02:42:00 GMT-0800 (PST), Consequatur deserunt consequuntur laudantium dolorem neque. Facilis iure vitae. Labore aut consequatur tempora non rerum dolores rem ut. Doloremque enim velit et qui eum iure vel culpa ut., 5, 2, 5, 4, 5, 3, 4
 370, 84, Syble, https://s3.amazonaws.com/uifaces/faces/twitter/plasticine/128.jpg, Sat Nov 25 2017 07:52:02 GMT-0800 (PST), Tenetur ad quia iste libero. Maxime doloremque asperiores dolor molestias sunt laudantium harum asperiores. Voluptatem sed ratione excepturi eos nihil. Omnis dignissimos quo mollitia eius aut repellat consequatur. Non eius delectus perferendis voluptas aliquid accusantium. Ut possimus maiores nulla provident consequatur saepe iure sunt porro., 3, 1, 3, 4, 1, 3, 1
 371, 78, Pascale, https://s3.amazonaws.com/uifaces/faces/twitter/melvindidit/128.jpg, Sun Dec 11 2016 04:35:35 GMT-0800 (PST), Quia minus consequatur amet quaerat temporibus eos dolore. Quos rerum qui cupiditate. Optio maiores omnis ad. Tempora tenetur qui rerum ratione aut deleniti non autem in. Autem debitis delectus et dolorum dolor fugiat dolores mollitia itaque., 4, 3, 5, 4, 5, 2, 2
 372, 58, Myrtie, https://s3.amazonaws.com/uifaces/faces/twitter/madshensel/128.jpg, Tue Mar 10 2015 06:06:53 GMT-0700 (PDT), Libero ad impedit aut cum saepe voluptas consequatur veniam. Animi sapiente incidunt. Molestiae velit est eos., 2, 4, 4, 1, 1, 3, 1
 373, 52, Chelsea, https://s3.amazonaws.com/uifaces/faces/twitter/scottkclark/128.jpg, Fri Aug 26 2016 12:54:29 GMT-0700 (PDT), Debitis earum quaerat velit ab nihil sint veniam. Veritatis veniam commodi sequi reprehenderit aspernatur. Dignissimos sit nihil fugit nostrum nesciunt nulla. Fugiat illo at illum. Provident sit sed eos ipsum sint maiores et. Ut amet laboriosam non repellat odit quia., 2, 3, 4, 5, 1, 5, 1
 374, 43, Prudence, https://s3.amazonaws.com/uifaces/faces/twitter/shvelo96/128.jpg, Fri Aug 02 2013 19:19:29 GMT-0700 (PDT), Quisquam magni veniam. Sed ut quia reiciendis at qui est porro. Et ut et inventore eos dolor. Atque culpa sed nisi. Rerum quia beatae quia nisi dignissimos., 5, 3, 4, 2, 2, 4, 3
 375, 36, Kareem, https://s3.amazonaws.com/uifaces/faces/twitter/danmartin70/128.jpg, Mon Aug 27 2012 08:27:21 GMT-0700 (PDT), Nostrum in maiores hic quae. Magni ab aliquam inventore sequi. Nesciunt vitae rerum vitae consequatur facere eligendi cum voluptates non. Porro voluptas et perferendis aut hic aliquid. Rem accusamus repellendus fugiat nesciunt aperiam et quis. Repellat dolorum possimus nobis provident voluptas quidem omnis., 4, 1, 5, 2, 2, 5, 5
 376, 68, Hollie, https://s3.amazonaws.com/uifaces/faces/twitter/daykiine/128.jpg, Wed Apr 23 2014 19:05:24 GMT-0700 (PDT), Deleniti deleniti ut voluptatem iure et vel natus rerum. Dolor in ut labore laborum illum corporis odit qui. Voluptas est excepturi et voluptatum qui vero sed rerum et. Facere excepturi eos voluptas. Quam quam amet., 3, 4, 2, 1, 1, 4, 1
 377, 52, Kendrick, https://s3.amazonaws.com/uifaces/faces/twitter/martip07/128.jpg, Wed Apr 13 2011 02:56:34 GMT-0700 (PDT), Eos itaque consequatur sunt minima quis ut. Quas quae in quas facilis vitae aut quibusdam maiores sint. Corrupti vel consequatur esse aperiam odit quis voluptatem tempora magni. Dolores quis tempore., 4, 2, 1, 1, 3, 2, 1
 378, 78, Meda, https://s3.amazonaws.com/uifaces/faces/twitter/cofla/128.jpg, Wed Jul 12 2017 15:29:23 GMT-0700 (PDT), Magnam earum aperiam aliquam eum. Consequatur sint nam labore voluptates dolor sint animi eum. Possimus reprehenderit sunt in ullam natus sapiente. Nesciunt autem ipsum exercitationem autem inventore voluptatum recusandae. Beatae non voluptate velit enim dolore magni autem perferendis iusto., 3, 2, 5, 1, 1, 2, 1
 379, 48, Maximus, https://s3.amazonaws.com/uifaces/faces/twitter/reetajayendra/128.jpg, Sun Dec 09 2012 20:40:55 GMT-0800 (PST), Corrupti magni sunt quia ad dolores rerum iste. Sed voluptas et minima qui voluptas et quibusdam animi sit. Vero dolores aut quam est accusamus doloribus necessitatibus doloribus laudantium. Qui veritatis possimus rerum id. Sint temporibus eligendi iure animi eaque inventore. Blanditiis fuga numquam sunt consequatur., 2, 4, 5, 1, 4, 4, 2
 380, 88, Jane, https://s3.amazonaws.com/uifaces/faces/twitter/tumski/128.jpg, Wed Dec 14 2011 23:05:42 GMT-0800 (PST), Ad laborum repellendus ratione possimus atque debitis officiis aut in. Repellat culpa facere amet placeat sit dolores deserunt fugit aut. Culpa debitis non eos aut eius facilis non qui veritatis., 5, 3, 1, 2, 4, 3, 1
 381, 93, Daren, https://s3.amazonaws.com/uifaces/faces/twitter/samuelkraft/128.jpg, Tue Dec 24 2013 04:24:41 GMT-0800 (PST), Qui quibusdam reiciendis dolores omnis dignissimos quia quia molestias sit. Ipsam et nihil iusto. Est minima quod in est ratione architecto quidem. Illum rerum sit ab repellendus. Sint tenetur similique placeat. Sed quia ex aperiam nobis., 4, 4, 1, 4, 2, 2, 3
 382, 83, Ricky, https://s3.amazonaws.com/uifaces/faces/twitter/marlinjayakody/128.jpg, Tue Apr 13 2010 04:41:56 GMT-0700 (PDT), Voluptatum earum maxime quia occaecati ea quidem atque. Magnam itaque tempora dolor qui dolorem est nostrum. Placeat est iusto voluptatem quis facere. Eligendi in velit blanditiis et autem aspernatur molestias saepe., 4, 3, 4, 4, 4, 3, 1
 383, 67, Judge, https://s3.amazonaws.com/uifaces/faces/twitter/bertboerland/128.jpg, Sat Nov 26 2016 02:53:59 GMT-0800 (PST), Sed fuga animi animi recusandae. Quod facere facilis eos sed dignissimos sed. Quam veritatis dignissimos. Fugiat aut iste. Consectetur voluptatem vitae., 3, 1, 1, 4, 3, 5, 2
 384, 68, Eva, https://s3.amazonaws.com/uifaces/faces/twitter/thedamianhdez/128.jpg, Thu Mar 03 2011 03:00:40 GMT-0800 (PST), Recusandae rerum nam aspernatur natus et consequatur sunt. Repellat voluptatem tempora distinctio sed iste voluptas. Voluptatem accusantium autem. Quis dolores mollitia., 4, 1, 1, 5, 3, 3, 4
 385, 8, Chasity, https://s3.amazonaws.com/uifaces/faces/twitter/markolschesky/128.jpg, Sat Oct 23 2010 02:07:16 GMT-0700 (PDT), Dolorem voluptas quia. Minima magnam culpa natus amet. Consequatur qui sit deserunt facere aut recusandae. Nihil et officiis cupiditate. Nam in recusandae corporis sequi placeat quia quis aut esse., 5, 2, 5, 3, 5, 2, 3
 386, 73, Douglas, https://s3.amazonaws.com/uifaces/faces/twitter/levisan/128.jpg, Sun Jan 31 2010 01:35:52 GMT-0800 (PST), Aliquid voluptas dolorum qui et consequuntur neque. Aut dignissimos provident qui ut. Enim saepe quisquam voluptatem et error neque. Illum rerum autem ducimus., 3, 4, 4, 4, 2, 1, 4
 387, 66, Destini, https://s3.amazonaws.com/uifaces/faces/twitter/prinzadi/128.jpg, Wed May 19 2010 16:57:49 GMT-0700 (PDT), Ullam quia et aut itaque ab. Voluptate dicta placeat rerum. Quo et enim aliquam et dolorem velit distinctio. Tenetur ut dolor esse quod. Reprehenderit soluta voluptatum tenetur sit. Voluptatem reiciendis rerum., 5, 2, 5, 5, 2, 3, 1
 388, 14, Craig, https://s3.amazonaws.com/uifaces/faces/twitter/ahmadajmi/128.jpg, Fri May 12 2017 07:07:20 GMT-0700 (PDT), Ducimus amet blanditiis quidem voluptatem omnis vitae nisi et itaque. Officiis molestiae magni aut quas possimus. Voluptatem laudantium praesentium veritatis consequatur voluptatum id saepe., 3, 2, 3, 3, 4, 3, 2
 389, 9, Alisha, https://s3.amazonaws.com/uifaces/faces/twitter/_vojto/128.jpg, Thu Apr 09 2015 20:28:46 GMT-0700 (PDT), Dolorem eum nulla eos similique nisi numquam. Magnam dicta in corrupti quae quasi necessitatibus. Ducimus molestiae dolor ipsa. Quae dolores perspiciatis in ducimus voluptatibus enim. Provident ut vitae veritatis deleniti placeat sed non. Expedita qui vel libero sit quae vero quidem aut., 2, 3, 3, 3, 5, 4, 2
 390, 61, Stevie, https://s3.amazonaws.com/uifaces/faces/twitter/xripunov/128.jpg, Sun Jul 30 2017 23:46:52 GMT-0700 (PDT), Quod aut et. Sapiente et debitis tempore cupiditate aut dolorum cum. Laborum optio omnis in reiciendis quos., 5, 1, 1, 2, 4, 1, 5
 391, 26, Heloise, https://s3.amazonaws.com/uifaces/faces/twitter/mizhgan/128.jpg, Wed Sep 25 2013 02:29:21 GMT-0700 (PDT), Nam voluptatum sunt quia tempore voluptas. Et iste ut. Et qui ipsum delectus qui ipsum rerum. Dolore aperiam ea temporibus pariatur ut. Iste quas et autem nesciunt voluptates dolores., 5, 3, 5, 3, 2, 3, 3
 392, 37, Edna, https://s3.amazonaws.com/uifaces/faces/twitter/fiterik/128.jpg, Sun May 30 2010 11:45:36 GMT-0700 (PDT), Repellat rerum voluptatibus accusamus quae. Possimus nihil odit illo esse in tempora. Sed optio beatae aut quos magni. Repellat enim et. Esse voluptatem aliquam est. Sit iure aut voluptas aut culpa maxime sint eos., 5, 1, 1, 1, 2, 2, 1
 393, 87, Rosie, https://s3.amazonaws.com/uifaces/faces/twitter/isnifer/128.jpg, Tue Dec 20 2016 17:17:38 GMT-0800 (PST), Et voluptas rem consectetur ad sed omnis a ullam aperiam. Et quod officiis ad laudantium delectus laboriosam. Culpa et optio quidem ut est nisi., 5, 4, 2, 3, 4, 1, 1
 394, 42, Bonnie, https://s3.amazonaws.com/uifaces/faces/twitter/_shahedk/128.jpg, Tue Nov 17 2015 12:09:32 GMT-0800 (PST), Aliquam quas aliquam ratione sed architecto nobis. Dicta qui doloremque non fugit debitis doloremque ad. Aliquid porro sint., 4, 2, 3, 3, 2, 4, 2
 395, 70, Ken, https://s3.amazonaws.com/uifaces/faces/twitter/mattsapii/128.jpg, Sat Aug 07 2010 05:13:08 GMT-0700 (PDT), Qui quia qui. Amet at voluptatem possimus doloremque quia tempore facere. Alias odio omnis libero quaerat non neque natus reiciendis. Eius dolore voluptatum sit nostrum iure omnis. Voluptatem quis et tempora voluptatem maxime quisquam., 2, 4, 3, 4, 4, 2, 3
 396, 79, Michael, https://s3.amazonaws.com/uifaces/faces/twitter/thaisselenator_/128.jpg, Thu Dec 16 2010 04:18:36 GMT-0800 (PST), In vitae molestiae commodi praesentium in fugiat beatae quia consequuntur. Aliquam enim distinctio ducimus ea cumque voluptas odit quos. Voluptas saepe quod placeat. Beatae voluptatem nihil in qui. Quisquam et id cum consequatur qui. Qui dolores ipsum suscipit voluptas soluta excepturi voluptatum natus cupiditate., 2, 4, 1, 3, 2, 4, 4
 397, 35, Mark, https://s3.amazonaws.com/uifaces/faces/twitter/bertboerland/128.jpg, Mon Mar 16 2015 08:00:55 GMT-0700 (PDT), Sint vel nulla voluptas distinctio quibusdam et aut praesentium. Et voluptas fuga eveniet earum non. Dolor est porro at dolorem. Eligendi cupiditate porro deserunt delectus. Rem voluptas voluptates est asperiores. Ab aliquam et et velit excepturi., 2, 5, 5, 2, 1, 3, 4
 398, 70, Katlyn, https://s3.amazonaws.com/uifaces/faces/twitter/opnsrce/128.jpg, Fri Aug 12 2011 20:02:12 GMT-0700 (PDT), Consequatur quidem velit est. Eum sunt quae aperiam corporis. Ut quia aut omnis ut dicta optio. Qui eum corrupti aliquid., 2, 5, 4, 5, 3, 1, 3
 399, 56, Katrina, https://s3.amazonaws.com/uifaces/faces/twitter/balakayuriy/128.jpg, Thu Feb 08 2018 15:01:01 GMT-0800 (PST), Quidem tenetur aperiam repellat fuga quas tempora aut quia tenetur. Ipsa labore et dolor hic. Quaerat ipsam soluta totam recusandae. Voluptatum vero impedit aperiam excepturi officiis tenetur ex. Quo dolor itaque., 2, 4, 2, 3, 5, 2, 4
 400, 32, Kaylee, https://s3.amazonaws.com/uifaces/faces/twitter/nerdgr8/128.jpg, Tue Jul 18 2017 21:08:09 GMT-0700 (PDT), Voluptatem ut id veritatis architecto totam quam aliquid quos iste. Porro delectus optio sint exercitationem sunt. Tenetur nobis ut. Vitae cumque necessitatibus animi quasi impedit accusantium dolores., 2, 3, 1, 5, 3, 1, 1
 401, 100, Reva, https://s3.amazonaws.com/uifaces/faces/twitter/allfordesign/128.jpg, Tue Sep 03 2013 20:20:12 GMT-0700 (PDT), Aut et qui necessitatibus qui quaerat laborum labore architecto. Aut dignissimos et id numquam magni minus. Ducimus deleniti ex., 4, 2, 2, 1, 5, 3, 5
 402, 45, Emil, https://s3.amazonaws.com/uifaces/faces/twitter/turkutuuli/128.jpg, Sat Mar 05 2011 21:12:31 GMT-0800 (PST), Vitae sit quas. Accusamus quam aut quae minus enim. Debitis nihil officia facere ea maxime non excepturi non. Est eos aliquam rerum placeat. Voluptatem cumque consequatur molestias qui error quia., 1, 1, 4, 4, 3, 4, 3
 403, 95, Kendra, https://s3.amazonaws.com/uifaces/faces/twitter/stefooo/128.jpg, Thu Sep 04 2014 10:33:21 GMT-0700 (PDT), Nulla pariatur qui voluptatem. Fuga eum sit aut tempora ut autem explicabo. Et repellendus assumenda. Dolores culpa dolore architecto impedit id. Sint error et odio nesciunt voluptate. Doloribus autem sed., 2, 2, 1, 2, 5, 3, 1
 404, 84, Fredy, https://s3.amazonaws.com/uifaces/faces/twitter/naupintos/128.jpg, Sun Jul 02 2017 06:50:27 GMT-0700 (PDT), Sit vero voluptatem quos explicabo ad magni ratione. Cum quas incidunt inventore a voluptatem eum aspernatur ab. Tempore laboriosam explicabo et non non est sunt magnam eligendi. Cumque voluptas minima similique impedit totam accusantium. Et fugit blanditiis porro quod qui ullam et blanditiis autem. Id iste ex doloremque libero architecto est ratione qui odio., 2, 3, 1, 4, 1, 4, 3
 405, 74, Trey, https://s3.amazonaws.com/uifaces/faces/twitter/traneblow/128.jpg, Sun Jun 02 2013 16:00:38 GMT-0700 (PDT), Nesciunt sapiente facere ut eum. Vero tempore repellat similique recusandae ratione et eligendi. Porro vero ut iure voluptate voluptatem sapiente., 4, 2, 5, 4, 3, 1, 2
 406, 1, Amiya, https://s3.amazonaws.com/uifaces/faces/twitter/lewisainslie/128.jpg, Sat Feb 25 2012 17:14:11 GMT-0800 (PST), Tempora nisi consequatur odit. Hic qui laborum ut. Commodi cum eius eum nemo autem. Aut occaecati libero ut natus eos et adipisci. Distinctio possimus inventore voluptas., 3, 1, 3, 1, 2, 3, 5
 407, 42, Scottie, https://s3.amazonaws.com/uifaces/faces/twitter/sharvin/128.jpg, Fri Feb 12 2016 02:54:51 GMT-0800 (PST), Magnam expedita qui ratione dicta ut non. Ex minus nam id. Quae ullam vitae deleniti exercitationem et sit atque omnis est. Rem sed labore veritatis., 1, 3, 4, 2, 2, 3, 4
 408, 98, Loren, https://s3.amazonaws.com/uifaces/faces/twitter/olaolusoga/128.jpg, Sun Mar 13 2011 10:50:43 GMT-0700 (PDT), Voluptas sit exercitationem officiis dolorum tenetur corporis odit at delectus. Ut culpa illo voluptatem doloremque voluptas animi. Et quo hic enim eius molestias repudiandae mollitia voluptatum qui. Sit adipisci aperiam aut sunt corrupti unde aut aut. Iste laborum fuga id est., 1, 2, 2, 3, 1, 2, 5
 409, 30, Roy, https://s3.amazonaws.com/uifaces/faces/twitter/mattsapii/128.jpg, Thu Nov 15 2012 07:13:34 GMT-0800 (PST), Enim consequatur nemo. Et facilis dignissimos et culpa non nemo. Et natus id., 2, 2, 5, 5, 2, 1, 1
 410, 94, Carmen, https://s3.amazonaws.com/uifaces/faces/twitter/angelcreative/128.jpg, Fri Sep 11 2015 12:06:37 GMT-0700 (PDT), Laborum perspiciatis aperiam quia mollitia asperiores pariatur ut. Cumque perspiciatis molestiae possimus. Facilis exercitationem soluta non similique. Quis facere qui est deserunt. Omnis et eos quo molestias est cumque et maxime. Animi reprehenderit cupiditate nemo libero voluptatem dignissimos maiores., 4, 1, 1, 4, 2, 5, 5
 411, 46, Braulio, https://s3.amazonaws.com/uifaces/faces/twitter/eugeneeweb/128.jpg, Thu Jun 26 2014 02:41:23 GMT-0700 (PDT), Sint error est. Nam sed unde numquam sed. Velit exercitationem provident est aliquam ipsa illum. Eum et error provident voluptatem debitis. Delectus voluptas consequuntur et magni., 2, 3, 5, 2, 2, 3, 4
 412, 82, Estella, https://s3.amazonaws.com/uifaces/faces/twitter/shadeed9/128.jpg, Mon Apr 19 2010 15:03:28 GMT-0700 (PDT), Eum blanditiis dolores hic rem natus alias iure. Neque non culpa dolore. Quaerat ipsam nostrum consequuntur nihil quia explicabo. At rerum adipisci alias voluptas at. Ut beatae eos eius dolores. Ipsa voluptas autem voluptatum ut autem ut odit praesentium., 3, 1, 1, 5, 2, 1, 5
 413, 40, Martine, https://s3.amazonaws.com/uifaces/faces/twitter/ipavelek/128.jpg, Tue Dec 01 2015 15:25:55 GMT-0800 (PST), Rerum repellendus at illum cumque magni quia. Rerum explicabo fugiat vel eaque expedita. Et aut vitae ipsum perspiciatis., 2, 4, 4, 2, 5, 4, 3
 414, 82, Alanna, https://s3.amazonaws.com/uifaces/faces/twitter/ssiskind/128.jpg, Wed Dec 28 2011 14:12:45 GMT-0800 (PST), Consequatur magni sit ab porro aliquam commodi et consequuntur. Dolorum quo et ex et et. Velit hic rerum labore et maxime quia quis. Architecto sunt dolor nemo omnis excepturi dolorem quis ab. Mollitia tempore laborum., 2, 1, 3, 4, 2, 5, 3
 415, 8, Ben, https://s3.amazonaws.com/uifaces/faces/twitter/mymyboy/128.jpg, Sat May 09 2015 02:49:43 GMT-0700 (PDT), Quia sapiente tempora odio dolor quis excepturi veniam mollitia tenetur. Soluta qui minima repellat molestiae. Suscipit voluptates in consectetur voluptates labore consequatur et consequatur. Magni dolore qui et suscipit velit magnam quia quia. Aut cupiditate fuga aut quo. Neque impedit alias aut vero., 1, 3, 1, 1, 5, 5, 2
 416, 20, Annamarie, https://s3.amazonaws.com/uifaces/faces/twitter/derekebradley/128.jpg, Sun Feb 07 2010 08:27:49 GMT-0800 (PST), Dicta dignissimos consequuntur aliquid ut quibusdam. Ipsa laudantium reprehenderit qui fugit quod. Aspernatur quia ratione. Deserunt dignissimos ducimus dolores vero omnis alias quasi inventore consequatur. Officiis quos officiis., 2, 5, 3, 1, 5, 5, 1
 417, 44, Anderson, https://s3.amazonaws.com/uifaces/faces/twitter/albertaugustin/128.jpg, Sat Oct 27 2012 16:36:37 GMT-0700 (PDT), In incidunt unde et aperiam. Vitae labore exercitationem nihil. Autem nihil aut maiores labore ut aut delectus autem. Exercitationem ullam est nihil ut accusantium. Quia nisi qui tenetur aut earum rerum sed id tenetur. Eligendi consectetur id aut., 2, 5, 4, 3, 4, 5, 2
 418, 41, Phoebe, https://s3.amazonaws.com/uifaces/faces/twitter/jerrybai1907/128.jpg, Tue Jan 22 2013 14:37:06 GMT-0800 (PST), Nesciunt repellat consequatur fugiat. Qui quo dolores. Nihil magni autem qui et rerum. Suscipit ipsam non doloribus eos velit., 3, 4, 4, 4, 4, 1, 4
 419, 67, Ashley, https://s3.amazonaws.com/uifaces/faces/twitter/eitarafa/128.jpg, Tue Aug 26 2014 11:46:13 GMT-0700 (PDT), Molestiae dolores et quis aut. Sint quo voluptas non id saepe vero amet officiis. Excepturi provident doloremque illo. In commodi quam porro et molestiae voluptatem voluptatibus ut. Occaecati adipisci asperiores. Numquam ad quidem provident sit tempore blanditiis velit omnis., 1, 2, 2, 2, 5, 3, 2
 420, 6, Jake, https://s3.amazonaws.com/uifaces/faces/twitter/nepdud/128.jpg, Fri Oct 07 2011 07:39:40 GMT-0700 (PDT), Doloribus molestiae quis deleniti qui. Non harum saepe nobis minima. Sit ipsam quisquam corrupti reiciendis temporibus doloribus eius molestiae cupiditate., 1, 4, 1, 1, 2, 5, 4
 421, 4, Wilber, https://s3.amazonaws.com/uifaces/faces/twitter/rawdiggie/128.jpg, Sun Oct 04 2015 08:15:29 GMT-0700 (PDT), Non nostrum expedita. Voluptas amet tenetur sequi voluptate distinctio eum laborum. Odio quas aspernatur aut illo ducimus., 3, 1, 4, 5, 3, 5, 1
 422, 86, Lia, https://s3.amazonaws.com/uifaces/faces/twitter/runningskull/128.jpg, Fri Feb 20 2015 09:39:20 GMT-0800 (PST), Quia odit consequatur eveniet. Eum ut aut eum. Alias magni quo iste qui nesciunt sapiente magnam quidem quia., 2, 5, 2, 5, 1, 1, 5
 423, 92, Karl, https://s3.amazonaws.com/uifaces/faces/twitter/mgonto/128.jpg, Tue May 22 2018 16:07:53 GMT-0700 (PDT), Molestiae distinctio voluptatem. Cum temporibus aliquid qui aut molestiae excepturi neque iure atque. Mollitia dolores mollitia nostrum rerum incidunt fugit non reiciendis ipsum. Ipsum et repellat., 5, 5, 2, 4, 2, 2, 1
 424, 13, Roman, https://s3.amazonaws.com/uifaces/faces/twitter/cybind/128.jpg, Fri Nov 04 2016 08:58:46 GMT-0700 (PDT), Quia delectus illo debitis ipsum dolores et. At qui blanditiis voluptatibus natus qui autem voluptatem maiores. Saepe occaecati nihil. Voluptate non voluptas voluptas doloremque quia corrupti veniam nulla quia., 2, 2, 3, 3, 1, 1, 2
 425, 17, Emiliano, https://s3.amazonaws.com/uifaces/faces/twitter/anjhero/128.jpg, Sat Aug 14 2010 12:53:35 GMT-0700 (PDT), Suscipit tempora quis esse. Tempora est itaque quas itaque ut quas. Voluptate facere voluptas consequuntur non vitae sit perferendis., 5, 1, 3, 5, 2, 4, 4
 426, 7, Harmon, https://s3.amazonaws.com/uifaces/faces/twitter/reideiredale/128.jpg, Sun Nov 02 2014 06:20:48 GMT-0800 (PST), Inventore hic qui qui veniam id. Dolorem eligendi non sint consequuntur provident enim earum. Cupiditate sed blanditiis assumenda eveniet doloribus quia et. Fuga sequi corrupti et quidem. Nulla et minima nostrum quia ea modi ea officia. Porro quod modi quod et dolorum deserunt assumenda ipsa possimus., 4, 5, 3, 2, 5, 4, 2
 427, 35, Lisa, https://s3.amazonaws.com/uifaces/faces/twitter/raquelwilson/128.jpg, Sat May 11 2013 06:48:30 GMT-0700 (PDT), In unde laborum blanditiis vel porro a in perferendis. Esse ipsa sunt. Aut ut dolores et quia. Veritatis veniam voluptates ad consequuntur. Et impedit provident., 5, 1, 4, 5, 3, 1, 2
 428, 99, Dawn, https://s3.amazonaws.com/uifaces/faces/twitter/mateaodviteza/128.jpg, Tue May 31 2016 20:35:29 GMT-0700 (PDT), Laboriosam atque aut quis. Dolores qui enim autem ad molestiae hic modi. Enim modi magni et consequatur eum sequi. Voluptas voluptates veritatis ut vel minus. Velit ut vel velit sed., 4, 4, 1, 1, 5, 1, 2
 429, 47, Teresa, https://s3.amazonaws.com/uifaces/faces/twitter/marcobarbosa/128.jpg, Wed May 21 2014 06:24:11 GMT-0700 (PDT), Omnis nisi et adipisci enim culpa reiciendis placeat. Et optio impedit est atque a est ut dolorem. Minus qui voluptatem omnis nesciunt. Libero dolores eum repellat labore. Laboriosam harum quia nemo. Sapiente possimus nulla est veniam repudiandae., 2, 5, 3, 4, 5, 3, 3
 430, 92, Anya, https://s3.amazonaws.com/uifaces/faces/twitter/itskawsar/128.jpg, Fri Apr 14 2017 16:05:24 GMT-0700 (PDT), Repellat eaque temporibus sint repudiandae magni molestiae suscipit corrupti. Voluptatem ipsa architecto alias qui omnis atque animi. Cumque perferendis quaerat eligendi. Ut et cupiditate voluptatum ullam non illum dolores velit., 3, 5, 3, 1, 1, 4, 3
 431, 24, Laurence, https://s3.amazonaws.com/uifaces/faces/twitter/chaabane_wail/128.jpg, Sat Aug 12 2017 14:03:16 GMT-0700 (PDT), Quae delectus deleniti ipsum non dignissimos ipsa. Iste ex earum eum aperiam commodi placeat vero. Occaecati porro culpa aut fugiat quisquam qui., 2, 3, 4, 2, 5, 4, 1
 432, 88, Kattie, https://s3.amazonaws.com/uifaces/faces/twitter/nitinhayaran/128.jpg, Thu Sep 22 2011 17:15:50 GMT-0700 (PDT), Dolores ipsum dolor libero distinctio velit ut molestiae non maiores. Corrupti vel modi qui ut ratione soluta ut. Labore ut amet enim aliquam. Reiciendis dolores quod voluptatum et exercitationem dolorem. Est vitae temporibus est eius sit et vitae., 4, 5, 4, 5, 2, 1, 5
 433, 46, Zion, https://s3.amazonaws.com/uifaces/faces/twitter/rachelreveley/128.jpg, Mon Jun 07 2010 02:11:10 GMT-0700 (PDT), Totam quia laborum blanditiis repudiandae illo quos laudantium voluptas temporibus. Voluptatem beatae necessitatibus libero cupiditate veniam totam minus modi occaecati. Aut cumque eius eos voluptatem vitae. Nobis et itaque minus ex id. Adipisci labore modi porro repellat aut quos pariatur. Accusantium saepe voluptatem eum quia facilis., 4, 2, 4, 4, 3, 2, 3
 434, 8, Lionel, https://s3.amazonaws.com/uifaces/faces/twitter/danro/128.jpg, Thu Feb 23 2012 19:22:15 GMT-0800 (PST), Est voluptate facere quibusdam omnis debitis ut. Laudantium voluptatibus repudiandae. Assumenda accusamus eligendi facere mollitia nemo a eius minima dolores., 4, 1, 4, 1, 5, 5, 4
 435, 18, Camilla, https://s3.amazonaws.com/uifaces/faces/twitter/jayrobinson/128.jpg, Sun Jan 23 2011 19:38:54 GMT-0800 (PST), Excepturi et nemo. Maiores aliquam dolor voluptatem in eos quia. Facilis in ut non quos voluptas minus est labore. Quia dignissimos omnis ipsum., 3, 4, 4, 3, 1, 3, 4
 436, 54, Kim, https://s3.amazonaws.com/uifaces/faces/twitter/thiagovernetti/128.jpg, Sun Oct 27 2013 05:32:37 GMT-0700 (PDT), Qui aspernatur vitae quo ut a est aut. Commodi nihil id cupiditate accusantium a asperiores nesciunt qui. Architecto corporis nihil quasi maxime eveniet consequuntur et provident qui., 2, 3, 4, 2, 1, 1, 4
 437, 17, Aric, https://s3.amazonaws.com/uifaces/faces/twitter/davecraige/128.jpg, Mon May 18 2015 03:31:23 GMT-0700 (PDT), Quam et sit exercitationem deleniti assumenda qui neque. Ut non soluta hic. Saepe voluptatem eos. Nesciunt et similique harum. Aliquam provident corporis nobis non debitis perspiciatis architecto culpa aut., 5, 5, 5, 2, 5, 1, 3
 438, 56, Santa, https://s3.amazonaws.com/uifaces/faces/twitter/rahmeen/128.jpg, Sat Oct 27 2012 17:26:01 GMT-0700 (PDT), Natus quia quos dolore. Facere magnam aut voluptatibus et voluptate debitis consequatur. At dicta nulla enim quia dolore similique ratione. Facere fugit quibusdam a enim. Voluptatem vel officia voluptatibus porro saepe est cum., 5, 4, 2, 3, 5, 3, 3
 439, 34, Dennis, https://s3.amazonaws.com/uifaces/faces/twitter/michaelabehsera/128.jpg, Sun Mar 15 2015 20:54:12 GMT-0700 (PDT), Aut neque autem. Quidem veniam velit consequuntur in. Ea illo nesciunt facilis molestias. Earum iusto voluptate voluptatibus sequi sint quis dolorem nobis et. Doloribus laboriosam quos ex veniam numquam ea distinctio illum. Aspernatur culpa quis aut id nisi sequi eum vitae est., 1, 5, 1, 5, 1, 2, 2
